PK_InfoEmpresas;nm_razao_social;fl_matriz
35722;MUSARDO CONTACT INTERMEDIACAO DE NEGOCIOS LTDA ME SC;sim
6444;LAURITA GONCALVES DE OLIVEIRA MEI;sim
34178;MILTON FERRETTI JUNG JUNIOR PALESTRAS ME;sim
34331;CAIXA ESCOLAR PRESIDENTE JOAO PINHEIRO;sim
34364;INSTITUTO SUPERIOR VIRTUAL DE EDUCACAO LTDA ME;nao
35724;SUL AMERICA COMPANHIA DE SEGURO SAUDE;nao
35710;CLEAN INDUSTRIA E COMERCIO DE PRODUTOS QUIMICOS LTDA ME;sim
6448;JULIA DE ALMEIDA SERVICOS DE DIGITACAO ME;sim
35714;PORTO SEGURO COMPANHIA DE SEGUROS GERAIS;nao
35718;COMPANHIA EXCELSIOR DE SEGUROS;nao
35699;QVIDA INDUSTRIAL LTDA ME;sim
6453;ANISIO RODRIGUES DE OLIVEIRA ME;sim
32949;ANTONIO DONISETE DE OLIVEIRA MOLLON ME;sim
6455;BOTON LINE ARTEFATOS DE METAL LTDA ME;sim
32961;SILVANA VIDAL DE BRITO MEI;sim
32964;JULIO CESAR DINIZ JARDIM ME;sim
6457;C DAS CHAGAS LINO COMERCIO ME;sim
32784;CICERO BATISTA DA SILVA LANCHONETE ME;sim
32776;NATALIA MARIA DA SILVA SUCOS ME;sim
35796;AGRA INCORPORADORA SA;sim
35756;COBRAS EMPREENDIMENTOS IMOBILIARIOS EPP LTDA;nao
35800;BOVE EMPREENDIMENTOS IMOBILIARIOS LTDA ME;sim
35783;OLIVEIRA DUTRA CONSTRUCOES LTDA ME;sim
35733;PLANOS DE ASSISTENCIA FUNEBRES E FAMILIARES PRIMICIAS LTDA;sim
6460;BERENICE BRITTO ATAIDE DE ARRUDA ME;sim
35729;POLIMEDICA ASSISTENCIA MEDICA LTDA ME;nao
35770;PROJETO FOX 41 DESENVOLVIMENTO IMOBILIARIO LTDA;nao
35772;CONDOMINIO EDIFICIO MONTE SINAI SPE LTDA;sim
34362;SOSTENES FREITAS DE ANDRADE ME;sim
34536;ANA PAULA MENDES MEI;sim
6398;SIM REDE DE POSTOS LTDA;nao
34370;SAR CONSULTORES ASSOCIADOS LTDA ME;sim
34372;DECISORIAL CONSULTORIA LTDA ME;sim
34445;NILTON SANCHES PINHEIRO FILHO MEI;sim
34360;IDRIANI AGUIDA SOUZA;sim
34354;ADRIANO DA SILVA COSTA GOMES MEI;sim
34481;AZEMEIS 2003 CONFECCOES COMERCIO E REPRESENTACOES LTDA ME;sim
34352;CONQUISTE CURSOS PROFISSIONALIZANTES LTDA ME;nao
34347;SYGNUS CONSULTORIA LTDA ME;sim
34356;SELMA LITRAN PERAZOLO CONSULTORIA;sim
34450;C R EMPRESA DE PUBLICIDADE LTDA ME;sim
34358;MARIA HELENA ALBERNAZ ARTESANATO ME;sim
34367;CENTRO RECREATIVO INFANTIL SEMENTINHA DO SABER LTDA SC;sim
34375;CENTRO DE EDUCACAO INFANTIL RECANTO DOS QUERUBINS;nao
34425;MARCELA COUTINHO FERNANDES DA SILVA MEI;sim
33764;NOBREGA ALBUQUERQUE CONSULTORIA EIRELI EPP;sim
34484;RAIMUNDA ZELIA DE SOUZA DA SILVA MEI;sim
34463;WORLDTEX INDUSTRIA E COMERCIO TEXTIL EPP LTDA;sim
34421;JEANINE FERNANDA GOVEIA MEI;sim
34436;RENATA FERREIRA DA SILVA VESTUARIO ME;sim
35694;ANTONIO MARCOS GOMES MONTEIRO MEI;sim
34438;CICERA CANUTO DOS ANJOS;sim
34416;CELIA TERESA ASENCIO ME;sim
33047;H F DE CASTRO LANCHES ME;sim
34384;EDLEUZA MARIA FERREIRA ME;sim
34382;CELFER INTERMEDIACAO DE NEGOCIOS EPP LTDA;sim
34379;DINA GIGLIO COPPA MEI;sim
34386;V DA S F CAMARA ME;sim
34410;CLAUDENIR MANOEL DE ARAUJO MEI;sim
34430;ODAIR JOSE LESSA MEI;sim
34345;CAIXA ESCOLAR POLIVALENTE DE ALAGOINHAS;sim
34343;ANTONIO FERNANDES FREIRE ME;sim
34465;OLIVEIRA & GARCIA LTDA ME;sim
34340;ASSOCIACAO CIVIL DAS SERVAS DE MARIA DO BRASIL;nao
32904;LIMA PIZZARIA E RESTAURANTE LTDA;nao
32108;AILTON MARTINS DE OLIVEIRA ME;sim
32089;VIACAO SANTA MARIA EPP LTDA;nao
32894;SALVADOR EUGENIO DA SILVA ME;sim
32091;MARCELO ROCHA TRANSPORTES ME;sim
26517;MELONIO ALVES E CIA LTDA ME;sim
32095;C M PEREIRA DIAS ME;sim
32101;ADRIANO ROGERIO FARIA MEI;sim
26345;GIOH PRODUCOES ARTISTICAS E EVENTOS EIRELI ME;sim
32211;GARUDA RECURSOS HUMANOS E CORRETORA DE SEGUROS LTDA;sim
26512;SEBASTIAO JOSE DA SILVA E OUTROS;sim
32173;ADRIANA LOPES DA SILVA TRANSPORTES ME;sim
32464;MAJESTADE RESTAURANTE LTDA ME;sim
32021;RONALDO NUNES TEIXEIRA MEI;sim
32027;FERNANDO DOS SANTOS PEREIRA MEI;sim
26547;EUCATEX IMOBILIARIA LTDA;nao
31974;GLEICE LIMA LINHARES E CIA LTDA ME;sim
32002;GRANBRASIL LOGISTICS LTDA;nao
32013;GRANDO & ANTONELLO LTDA ME;sim
26555;N SANTOS SILVA;sim
26375;J A M REPRESENTACOES COMERCIAIS LTDA ME SC;sim
26094;LEANDRO AUGUSTO DE SORDI MEI;sim
26126;THIAGO ROGERIO LOURENCO MEI;sim
26153;TACIANE RIBEIRO PRODUCOES LTDA ME;sim
26121;CARLOS PAIVA REFORMAS DE IMOVEIS LTDA ME;sim
32262;GARCIA E SILVA ADMINISTRADORA E CORRETORA DE SEGUROS LTDA;sim
26118;LUCIANO CAMPOS ME;sim
32289;CABALA ADMINISTRADORA E CORRETORA DE SEGUROS LTDA ME;sim
32161;FLG TRANSPORTES RODOVIARIOS EPP LTDA;sim
32165;FLYING TRANSPORTES E TURISMO LTDA ME;sim
32159;SNK TRANSPORTES EXPRESSO LTDA ME;sim
32152;GLOBAL TUR TRANSPORTE E TURISMO EIRELI EPP;sim
32144;ROBERTO CARLOS RAMOS TRANSPORTE ME;sim
32156;JOAO JOSE DA CRUZ TRANSPORTE ME;sim
26114;LLETRIAL CONSTRUCOES E MANUTENCAO PREDIAL EIRELI ME;sim
26181;ANTONIO GOMES ME;sim
36048;CERAMICA GUIMARAES EPP LTDA;sim
36016;MIL MARMORES E GRANITOS LTDA ME;sim
32853;MELISSA DANIELE RODRIGUES MARQUES DA SILVA MEI;sim
6469;FARMACIA FAGUNDES VARELA LTDA ME;nao
36248;GRAFICA RIO DAS PEDRAS LTDA ME;sim
36246;PROGRESS EMPREENDIMENTOS EDITORIAIS LTDA;nao
36297;ENERGIA COMERCIO E INDUSTRIA DE ARTEFATOS DE PAPEL LTDA ME;sim
36252;ANDREIA TRIQUES MEI;sim
36288;REVISTA CARPE DIEM LTDA ME;sim
36291;RODRIGO DA SILVA MAFFEI MEI;sim
36281;SERGIO L JOST ME;sim
36254;ARISTON LEITE DOS SANTOS ME;sim
36265;JOSINALDO JOSE DAS NEVES MEI;sim
36235;EDITORA A NOTICIA LTDA ME;sim
36199;FUSAO EDITORIAL LTDA ME;sim
36309;DIEGO ANDRADE PEREIRA MEI;sim
36301;MMJX COMUNICACAO LTDA ME;sim
36140;CRISTIANO MONTEIRO DE BARROS MEI;sim
36066;L M PUBLICIDADES COMERCIO E SERVICOS LTDA;sim
36180;MILTON PEREIRA DE BARROS JUNIOR MEI;sim
36165;CAPGRAF EDITORA INDUSTRIA COMERCIO E SERVICOS LTDA ME;sim
32841;SIDNEI RICARDO VENTURA ME;sim
36070;GATTO FABRICA DE ARTEFATOS DE CIMENTO LTDA ME;sim
36075;DJALMA BARBOSA DA SILVA ME;sim
36095;PIAS ALVORADA LTDA ME;sim
36098;CERAMICA CAMILA LTDA ME;sim
36116;LAURO LOPES OLIVEIRA JUNIOR MEI;sim
32163;DAMIAO PEREIRA FEITOSA ME;sim
32168;CR BITENCOURT TRANSPORTE RODOVIARIO DE CARGAS LTDA ME;sim
33686;ALCENI MARIA SCHUARTZ ME;sim
36093;WAGNER DA SILVA FERREIRA ME;sim
36531;PROTASIO JOAO MARTENDAL FILHO ME;sim
6485;ANTONIO JOSE DE OLIVEIRA AVICULTURA ME;sim
36090;CERAMICA SANTA ELVIRA LTDA ME;sim
6489;TEREZA CRISTINA RODRIGUES DE SOUZA ME;sim
36088;FERNANDO JUBANSKI ME;sim
26215;MF PROMOCAO E ASSESSORIA DE EVENTOS LTDA ME SC;sim
26227;ALDEN GARCIA DE ALBUQUERQUE E SILVA MEI;sim
26207;MURIQUI CONSULTORIA AMBIENTAL LTDA ME;sim
26090;FABIANA ANDRADE DE SOUZA MEI;sim
26074;JESOE OLIVEIRA DA SILVA MEI;sim
32209;ELIZETE CORRETORA E ADMINISTRADORA DE SEGUROS LTDA ME;sim
26076;CARLOS MAGNO NASCIMENTO TOREZANI MEI;sim
26079;UNIVERSO COMERCIO E LOCACAO DE TENDAS LTDA ME;sim
26096;JURACI GOMES DE MENEZES MEI;sim
26106;ELECTRIMAR SERVICOS ELETRICOS LTDA ME;sim
32220;FENIX INTERMEDIACAO DE CREDITO LTDA;sim
26110;JULIANO LUIZ LICHT MEI;sim
26098;JONAS RODRIGUES ARQUILINO ME;sim
26101;ALCIDES TOLOZA LIZCANO MEI;sim
26129;SANSHAI REPRESENTACOES LTDA ME;sim
26319;MARIA HERMINIA DE OLIVEIRA;sim
32204;NOBRE ZSULSEG ASSESSORIA DE SEGUROS LTDA ME;sim
26296;COOPERATIVA PINHAIS DE PRESTACAO DE SERVICOS;sim
26311;SANDRA SANTOS DA PENHA MEI;sim
32171;BASTOS & BASTOS TRANSPORTE ESCOLAR LTDA ME;sim
32202;COBALTO CORRETORA E CONSULTORIA DE SEGUROS LTDA ME;sim
32135;JURANDY SILVA GOMES MEI;sim
32141;HIRT TRANSPORTE RODOVIARIO LTDA ME;sim
32093;JULIO CESAR SILVA TRANSPORTADORA ME;sim
32114;MARIA NATIVIDADE DE MELO VESELICH MEI;sim
32133;BESTWAY LOCACOES E SERVICOS LTDA ME;sim
32139;SUZANA MIRIAM RIBEIRO TRANSPORTES ME;sim
32126;F DE ASSIS PAULINO LIMA ME;sim
26294;GRACILIANO DE JESUS TORRES ME;sim
26288;F LUIZ MOZZER ME;sim
26292;FUSAZAKI ASSESSORIA EM TRADUCOES LTDA ME SS;sim
32119;ALEXANDRO PEREIRA LUIZ MEI;sim
32117;LEANDRO DA COSTA FONSECA MEI;sim
26301;RONALDO SANTOS SARAIVA MEI;sim
32123;RNL EXPRESS TRANSPORTES LTDA;sim
32111;JOVANE ZILIO FABRIS ME;sim
26313;ARKYART ORGNAZ DE ESPACOS E ARTES VISUAIS LTDA ME SC;sim
32251;LONGHI CONSULTORIA E PROJETOS LTDA SC;sim
32314;EDIEL VIEIRA RANGEL ME;sim
32345;MINAS ONLINE LTDA ME;sim
26278;LENIRA DUARTE DA CUNHA AZEVEDO ME;sim
26247;FACIL RH GESTAO DE RECURSOS HUMANOS EPP LTDA;sim
32308;TRILHA DIGITAL SISTEMAS DE DADOS LTDA ME;sim
26263;POZENATO ASSESSORIA TECNICA PROJETOS E SERVICOS LTDA ME SC;sim
26243;MARX VIDEO PRODUCOES LTDA ME SS;sim
32287;JC CORRETORA DE SEGUROS LTDA ME;sim
32231;NAOMI SANSEG CORRETORA DE SEGUROS LTDA ME;sim
32326;APARECIDO ALVES LOPES ME;sim
32350;GUIA ELETRONICO SISTEMAS LTDA ME;sim
32380;DEVELOPMENT RH DE RESULTADOS LTDA ME;sim
32383;L N M PROCESSAMENTO DE DADOS LTDA ME;sim
26236;R A SALVO;sim
32370;PASCHOAL MUINOS ARENAS ME;sim
32360;EVIDENCIA TECNOLOGIA EM INFORMATICA EPP LTDA;sim
32358;ANDRE LUIZ ALVES COSTA INSTALACAO DE SOFTWARE ME;sim
26241;ROSIN REPRESENTACOES LTDA ME;sim
26259;FERREIRA E ALVES ASSOCIADOS LTDA ME;nao
26265;CARLOS COSTA BASTOS DA SILVA & CIA LTDA ME;sim
32366;HELIO K ABE ME;sim
32382;INFORSERVER CONSULTORIA E SERVICOS EM INFORMATICA LTDA ME;sim
26276;CATIA REGINA FRANCO MEI;sim
33092;MEUCANTO PIZZARIA KIDS LTDA ME;sim
26282;TAMARA HERTER MANCUSO MEI;sim
26274;SANCHEZ SANTOS REPRESENTACOES COMERCIAIS LTDA ME;sim
32274;JASPE CORRETORA DE SEGUROS E REPRESENTACOES LTDA ME;sim
26268;RPS FOTOGRAFIAS LTDA ME;nao
26525;PAULO AFONSO DE OLIVEIRA COSTA;nao
26716;DANILO COSTA LIRA;sim
26713;NOBEL ASSESSORIA CONTABIL LTDA ME SC;sim
26685;QUADROS CONTABILIDADE LTDA ME;sim
5839;FRANCISCO LOPES DA SILVA FILHO MEI;sim
26682;PALMEIROPOLIS CARTORIO DO SEGUNDO OFICIO DE NOTAS;sim
33095;GIBAO DE VAQUEIRO BAR E RESTAURANTE LTDA ME;sim
33437;JEFFERSON RODRIGUES FLORENCIO;sim
33443;ROQUE CEZAR BRAGA ME;sim
36304;EDITORA TRES IRMAOS LTDA ME;sim
33451;ANTONIO FELIPE ME;sim
33419;HELOISA SARAIVA SANTOS ME;sim
33457;RESTAURANTE RIBAS LTDA ME;sim
33570;JOSE REGINALDO DA SILVA CIPRIANO ME;nao
33537;PAIOT ALIMENTACAO LTDA ME;nao
33461;ANGELA DENISE SANCHES LAIRANA MEI;sim
36237;DIOGO SIQUIERI DA SILVA MEI;sim
32922;BAR BANDEIRANTES LTDA ME;sim
36234;JORGE REINALDO MARQUES ME;sim
33028;SIRLEIDE LOPES GOMES MEI;sim
33541;ROBERTA PEREIRA CELESTINO MEI;sim
33543;CREPE SUZETE ORGANIZACAO DE FESTAS LTDA ME;sim
33023;MARIA J DA SILVA FERNANDOPOLIS ME;sim
33008;NEUSA ABADIA DE ARAUJO ME;sim
33522;FRANCISCO SALVE RODRIGUES OTAVIANO MEI;sim
33006;LILIANA OLIVEIRA ROLIM ME;sim
32998;PASTELARIA EMANUEL LTDA ME;sim
33004;ZENIA BRAZ DE SOUZA MACEDO MEI;sim
33010;M V DE FREITAS FILHO;sim
33020;DUCACAU COMERCIO DE ALIMENTOS EPP LTDA;nao
36188;DIARIO DE PERNAMBUCO SA;nao
33025;MACIEL & ALVES LTDA;sim
33017;NOVA JORNADA RESTAURANTE SA;nao
33013;TEREZINHA DE SOUZA ABREU MEI;sim
33568;RODRIGUES & FABIO RESTAURANTE LTDA ME;sim
33518;ANA CRISTINA TAKIKAWA ME;sim
33557;MICHELE CRISTIEN BERTOLINO MEI;sim
33015;LANCHONETE ROGRO LTDA ME;sim
36210;RENAN EDICAO INTEGRADA A IMPRESSAO ME;sim
33547;JULIA LIMA SANTOS ME;sim
32806;ANDERSON TOMAZ AGUIAR MEI;sim
33000;LANCHONETE CASA GRANDE LTDA ME;sim
33554;JOAO ADAO VARGAS DE FREITAS ME;sim
33966;CONSELHO DA CRECHE ESCOLA PROFESSOR NERY;sim
33989;EDUCANDARIO SANTA ROSA LTDA ME;sim
36241;EDITORA JORNALISTICA ESTRELA FLAMIGERA LTDA ME;sim
6492;ANTONIO CARLOS DE MELO DOS SANTOS MEI;sim
37295;ARTES GRAFICAS RODRIGUES LTDA ME;sim
33566;CIRO FERREIRA DA SILVA & CIA LTDA ME;sim
37289;ESTUDIO FOTOLITECNICA LTDA;sim
37292;SCN PRODUCOES CULTURAIS E ESPORTIVAS LTDA ME;sim
33512;I A V MOREIRA RESTAURANTE ME;sim
33479;ANA PAULA DOS SANTOS DA SILVA NUNES MEI;sim
33465;OLGA FERNANDES BARRETO ME;sim
33467;DILSON DE MORAES ROCHA JUNIOR MEI;sim
33470;DENIVAL RODRIGUES OLIVEIRA MEI;sim
33481;ROSSANA A DOURADO RESTAURANTE ME;sim
32833;LANCHONETE LUITALI LTDA ME;sim
33510;ROSENILDE DE ARAUJO BARROS MEI;sim
33508;OLAVO NASCIMENTO DA SILVA MEI;sim
33919;CONSELHO DELIBERATIVO ESCOLAR DO CENTRO DE EDUCACAO INFANTIL BALAO MAGICO;sim
33514;WALLY GEWEHR ME;sim
33516;LANCHES 14 DE MAIO LTDA ME;sim
33495;IVONETE DOS SANTOS ARRUDA ME;sim
32823;BCEM COMERCIO DE PRODUTOS ALIMENTICIOS LTDA;nao
6464;FABIO GONCALVES LIMA MEI;sim
33823;CAIXA ESCOLAR RAIMUNDO NONATO BATISTA;sim
35806;TERRA DI VERNAZZA INCORPORADORA LTDA;sim
6497;ROGERIO SILVEIRA;sim
33529;CELIO MADRUGA ME;sim
32825;SHUI RESTAURANTE LTDA ME;sim
33422;MARIA SANTA DA SILVA BUFFET DE PIZZAS ME;sim
33424;EDMILSON CORREIA DO NASCIMENTO ME;sim
33417;ADMAR LANCHES LTDA ME;sim
6341;FRANCISCO ABREU DO VALE ME;sim
33448;LILIANE APARECIDA SILVA DE OLIVEIRA MEI;sim
33445;ARLINDA CORREIA DE AMORIM MEI;sim
33454;R M DE RESENDE LANCHONETE ME;sim
32811;K Z LEAL ME;sim
32880;PIRES RESTAURANTE LTDA ME;sim
32916;DIRCE FERREIRA PELISSARI ME;sim
35813;MARCOS FERREIRA DE FREITAS ME;sim
33053;PAULO LUCIANO DA SILVA MEI;sim
33051;CIDONI LUCIA CREMONINI ME;sim
35810;PARTIFIB PROJETOS IMOBILIARIOS CAIUBI LTDA;sim
33055;GANDI COMERCIO DE ALIMENTOS LTDA;sim
33066;FAMILIA GIRON PIZZARIA LTDA ME;sim
35815;AJUA EMPREENDIMENTOS E PARTICIPACOES LTDA ME;sim
35827;FRANCISCO UAGILON LIMA DA SILVA ME;sim
35825;AMARILIS EMPREENDIMENTOS IMOBILIARIOS LTDA;sim
35818;GEORGINA BUSINESS PARK SPE LTDA;sim
35822;JARDINS MANGUEIRAL EMPREENDIMENTOS IMOBILIARIOS SA;nao
36061;MANOEL DE SOUZA E SILVA EPP;sim
33061;MARIA DOS ANJOS GOMES CORREA ME;sim
36020;ART DECOR INDUSTRIA E COMERCIO LTDA ME;sim
36022;LUIZ CARLOS DE OLIVEIRA BUENO EPP;sim
36024;JODEVAL VICENTE DE SOUZA ME;sim
36018;GLAUCIA MARIA BARROS DA SILVA GRATIVAL MEI;sim
32953;DH COMERCIAL PRESTADORA DE SERVICOS LTDA ME;sim
32982;PABLO ESTEVAN MORAES MARIA ME;sim
33851;GRANDE PORTE TREINAMENTOS EM INFORMATICA LTDA ME;sim
36012;SIMONE RODRIGUES NALON DA SILVA MEI;sim
32980;SILVIO DE PAULA CABRAL ME;sim
32984;PRISCILA DE MORAIS RODRIGUES ME;sim
32990;CEZARIO CARDIM SANTOS ME;sim
32986;JOSE ANTONIO ARAUJO ROCHA ME;sim
35997;MINERIOS CURUCA LTDA ME;nao
32978;ELZA DE JESUS RODRIGUES ME;sim
35992;JOAO FRANCISCO CIREZOLA ME;sim
32970;GASPAROTO & DARROZ LTDA ME;sim
32968;RODRIGO DA SILVA MEI;sim
36028;FABRICA DE GESSO CHAVES LTDA ME;sim
36038;INDUSTRIA E COMERCIO DE REFRIGERACAO OSMAK LTDA ME;sim
32972;ED FER COMERCIAL LANCHONETE LTDA ME;sim
36041;BOM BLOCO LTDA ME;sim
36058;ALTO VALE MARMORES E GRANITOS LTDA ME;sim
35951;FABRICA DE BLOCOS E FERRAGENS DONIZETI LTDA ME;sim
35874;VICORP ITAICI LOTEAMENTOS;sim
35865;BRACON 03 EMPREENDIMENTO IMOBILIARIO LTDA;sim
35880;GILBERTO CAMBRAIA ME;sim
35863;BRUGGE INCORPORACAO SPE LTDA;sim
35982;JOAO SILVESTRE MAZZOCHI BRAGANCA ME;sim
35836;ER PARTICIPACOES E EMPREENDIMENTOS LTDA ME;sim
32974;TAUFER & SILVA LTDA ME;sim
35832;EDSON MERLO ME;sim
35843;CONSORCIO CONDOMINIO GOLF VILLE II;sim
35858;MRV PRIME XXIII INCORPORACOES SPE LTDA;nao
35877;BRUSAN CONSTRUCOES EPP LTDA;sim
35882;K R EMPREENDIMENTOS E INCORPORADORA IMOBILIARIA LTDA;sim
35944;FORT LAJE ARTEFATOS DE CIMENTO LTDA ME;sim
33039;C S P MACHADO ME;sim
35914;ROGERIO DUARTE RODRIGUES CONSTRUCOES ME;sim
33847;ANTOINE HADDAD DE SIQUEIRA MEI;sim
35953;AUREA MARIA RODRIGUES FERREIRA MEI;sim
35955;VITABLOCO ARTEFATOS DE CONCRETO LTDA ME;sim
33085;ENI CALDAS CARDOSO MEI;sim
35906;ANTONIO FERNANDO DE ARAUJO GARCIA;sim
33079;SUSANA ROCHA DA SILVA ME;sim
33077;MANOEL LIMA FIGUEIREDO ME;sim
33073;DEJALMIR SILVA LOPES MEI;sim
33082;RAMILDO GONCALVES MEI;sim
33098;CARLOS HENRIQUE BATISTA MEI;sim
33087;EDI LOPES ETHUR MEI;sim
35899;REFORMEC REFORMAS EM CONSTRUCAO CIVIL LTDA ME;sim
35892;QUICK UBIATANS 476 EMPREENDIMENTOS IMOBILIARIOS SPE LTDA;sim
35884;FORTCON CONSTRUTORA E INCORPORADORA LTDA ME;sim
6246;JOSEMIR ARAUJO SILVA PRESENTES ME;sim
35902;SALIM & GALVAN INCORPORACOES EPP LTDA;sim
32837;SAPORE DI FESTA SERVICOS PARA EVENTOS LTDA ME;sim
32839;ELOI FREITAS DO CALMO ME;sim
24701;ANDRADE GUTIERREZ ENGENHARIA SA;nao
37333;BRAGAL MINERADORA LTDA ME;sim
37316;DOUGLAS ANDRADE VARELA DA SILVA MEI;sim
6571;MARCELO MARINHO MAGNAVITA MEI;sim
37354;JOSE SERGIO BARROS DA CRUZ MEI;sim
37390;MOTIVATION INCENTIVOS PROMOCOES E VIAGENS LTDA ME;sim
6612;MARY LUCIA ALVES VALDIVINO MEI;sim
37384;TREKK BRASIL TURISMO DE AVENTURA LTDA ME;sim
37475;IBICACAMBAS SOCIEDADE SIMPLES LTDA ME;sim
37713;VULCAN MATERIAL PLASTICO LTDA EM RECUPERACAO JUDICIAL;nao
6501;POSTO LEAO DA ILHA LTDA;sim
6386;GRACIELLE KSZAN FRANCISCO MEI;sim
6436;VANIA MARIA DE VASCONCELOS MEI;sim
6338;NAYARA CRISTINA SANTOS MEI;sim
6513;RENIR RAMALHO DE OLIVEIRA ME;sim
37677;IMPLANTA RS TECNOLOGIA DE SEGURANCA LTDA ME;sim
7624;MARCELLA DE ARAUJO GARCIA MEI;sim
6632;ROSELAINE RODRIGUES MEI;sim
6723;SONIA MARIA EBERTZ RODRIGUES ME;sim
6773;COMERCIAL MISTER MOORE LTDA ME;sim
6702;FRANCIELE PIASSA GENOVAI MEI;sim
6662;CORACAO BRASIL EDITORA LTDA ME;sim
6667;H & M P FIGUEIRA LTDA ME;sim
6062;FABIANA SOUSA PONTES DO AMARAL MEI;sim
6749;LUNI SEG SEGURANCA ELETRONICA LTDA ME;sim
6251;EDGARDO MARCOS ASTOLA SANCHEZ MEI;sim
6093;DOMINGOS CAMDEIRA DA SILVA MEI;sim
37803;N C UBAENSE INDUSTRIA E COMERCIO DE MAQUINAS E EQUIPAMENTOS AGRICOLAS E INDUSTRIAIS LTDA;sim
37849;METALURGICA CASAGRANDE LTDA;sim
37809;SPRINGWAY IMPORTACAO EXPORTACAO COMERCIO E SERVICOS LTDA;nao
37693;TRANSPORTES 21 LTDA ME;nao
37743;ARTE POLIESTER INDUSTRIA E COMERCIO EIRELI EPP;sim
6071;DEIDE LUCIA OLIVEIRA DA TRINDADE MEI;sim
37696;M E DE OLIVEIRA E CIA LTDA ME;sim
37776;PURE PLASTICS DO BRASIL LTDA ME;sim
37521;JOSE HENRIQUE DEMARQUES MEI;sim
6087;ARTHUR ABIJAUDE FILHO ME;nao
6114;GULART & MUMBACH LTDA ME;sim
6242;LUIS CARLOS MORO JUNIOR ME;sim
6262;FUNERARIA E FLORICULTURA SANTA RITA DE CASSIA LTDA ME;nao
6132;MILTON RODRIGUES CARVALHO ME;sim
6119;CARLA ANDRESSA DELL AGNOLO MEI;sim
6122;SUZI APARECIDA BISPO LIMA MEI;sim
6595;LUCIANO ROLIM DOS SANTOS MEI;sim
7342;GERALMAX A COMERCIAL EPP LTDA;sim
7502;RIO NORTE MATERIAIS DE CONSTRUCOES LTDA ME;sim
7758;INESSA PEREIRA DE LIMA ME;sim
7271;J M R CORREIA DA SILVA ME;sim
7357;NAIR CARDOSO DA SILVA MEI;sim
37397;PROMOTUR PROMOCOES VIAGENS E TURISMO LTDA ME;sim
7471;CELMA MARTINS SILVA MEI;sim
7440;METALPLAN COMERCIO DE PECAS METALICAS EPP LTDA;sim
37297;CLEBER MARCELINO DE GOIS ME;sim
7260;MARCIO ADRIANO RUIZ ME;sim
7434;ELBIO ALVES DE ALMEIDA MEI;sim
6516;MAJA M M DE OLIVEIRA E SILVA MOVEIS ME;sim
7460;ADENILSON DOS SANTOS CAMARA MEI;sim
7610;W A DISTRIBUIDORA E IMPORTADORA LTDA ME;sim
7133;L PIRES ME;sim
6859;F & F COMERCIO REPRESENTACOES E SERVICOS DE MATERIAL MEDICO E HOSPITALAR LTDA ME;sim
7630;GIULIANA PICANZO DE MORAIS SODER ME;sim
6902;AMELIO FRANCISCO DO PRADO ME;sim
6815;COMERCIAL TC COMERCIO DE CONFECCOES EIRELI ME;nao
7739;MACEDO & MACEDO FARIA EPP LTDA;nao
37589;CONSELHO DE ADMINISTRACAO DO FUNDO DE APOSENTADORIA E PENSOES DOS SERV MUNICIPAIS DE PEDRO GOMES;sim
7745;EQUIPADAO COMERCIO VAREJISTA DE ACESSORIOS PARA VEICULOS LTDA ME;sim
6790;RIVONALDO RIBEIRO CHAVES JUNIOR MEI;sim
7743;JOSENILDE MARIA DE LIMA ME;sim
37624;CONSELHO TUTELAR DE PENEDO;sim
6805;TECH CELL SOFTWARE E COMPUTADORES LTDA ME;sim
37684;LUCIENE MARQUES DA SILVA ME;sim
7755;ESSENCIA COMERCIAL LTDA;nao
7834;JOAO NASCIMENTO DOS SANTOS & CIA LTDA ME;sim
6542;MARIA GISLAINE DE SOUZA CONFECCOES ME;sim
7899;E A PEREIRA FILHO ME;sim
7788;ANNE COMERCIO DE COSMETICOS LTDA ME;sim
8040;MARCOS VINICIUS FERREIRA DOS SANTOS MEI;sim
7992;KENERIKA LIVRARIA PAP LTDA ME;sim
7846;ARNO ARNILDO BLANK MEI;sim
8031;EDIVANIA BATISTA DE ANDRADE ME;sim
8045;J DE MEDEIROS DANTAS ME;sim
7810;MANOEL ALEXANDRE ABELANDAVON FLEBE ME;sim
7805;MOMENTO MASSAGEM LTDA ME;sim
7815;ADRIANA CRISTINA RODRIGUES CARRIEL ME;sim
7801;CASA DE CARNES DELICATESSE LTDA ME;sim
6538;NEUDETE DA ASSUNCAO ELIAS MEI;sim
7825;PAULO SIQUEIRA MEI;sim
8035;MMV DISTRIBUIDORA DE MATERIAIS PARA CONSTRUCAO LTDA ME;sim
7783;DE PLA MATERIAL FOTOGRAFICO LTDA;nao
7876;J J KURPEL CALEGARI & CIA LTDA ME;sim
7859;DISA MOTOS LTDA;nao
6555;JOSE FABIO LOUREIRO DA SILVA ME;sim
8176;LETICIA DE ALMEIDA SOARES ME;sim
6559;REJANE VERONICA CIPRIANO DO NASCIMENTO ME;nao
8179;G R DA SILVA COM FAB E PRESTACAO DE SERVICOS ME;sim
7945;HELIO FREIRE DE OLIVEIRA ME;sim
8190;ANTONIA RIVANDA LIMA PINHEIRO ME;sim
33207;LANCHONETE E PASTELARIA TIA LUZIA LTDA ME;sim
7942;LISANDRO COMERCIO VAREJISTA DE MODA EPP LTDA;nao
8192;ANDREIA CRISTINA ALVES MEI;sim
37463;JOSE ROBERTO CASTELLO DE TEVES MEI;sim
8208;ADAN BARBOSA SILVEIRA MEI;sim
37421;MARY VOUILLAMOZ ALBUQUERQUE;sim
8203;JUAREZ JOSE BIDINOTO ME;nao
8188;COMERCIO DE TINTAS E VERNIZES MARITACA LTDA ME;sim
7977;CARLOS ALBERTO DUARTE DA SILVA MEI;sim
8205;KREWER E ABREU LTDA ME;sim
8185;PRIMEIRA LINEA DE BOUTIQUE LTDA ME;nao
7837;HERMIO DOMINGOS NADAL ME;sim
6898;WCR EQUIPAMENTOS E MONTAGENS LTDA ME;sim
6982;CARMELINA DE SOUSA MEI;sim
7852;E R FERREIRA COMERCIAL ME;sim
7100;GREICE MATOS MEI;sim
7136;A G B P DE MELO ME;sim
7056;PET CARINHO COMERCIO DE ARTIGOS PARA ANIMAIS LTDA ME;sim
6995;LEONICE SILVA SANTOS MEI;sim
7025;COOPERATIVA AGROINDUSTRIAL ALFA;nao
7458;CARLOS ANDRE DE FARIAS MEI;sim
37603;PROCURADORIA GERAL DO ESTADO;nao
7406;M H REOLON PRADO & CIA EPP LTDA;sim
37593;MINISTERIO DA FAZENDA;nao
7280;ERM DAS NEVES CONFECCOES ME;sim
7284;ELIETE MARIA MAGALHAES DO AMARAL MEI;sim
7391;A DA S PINHEIRO ME;sim
7409;ERIKA CRISTINA DA SILVA NASCIMENTO MEI;sim
6067;PAPA TUDO MASS LTDA ME;sim
6778;DIONIL GUEDES ME;sim
7817;EDUARDO GUSMAO DE CASTRO ME;sim
7791;GARCIA & BUZACHI LTDA ME;sim
7820;ANGEL COMERCIO DE ROUPAS LTDA ME;sim
7822;FERNANDA NICOLE RIBEIRO ZANELLA ME;sim
7864;ROGERIO FURTADO KONRADT ME;sim
7808;MIGUEL MATIAS PAIFFER ME;sim
8462;MV NOVIDADES E PRESENTES LTDA ME;nao
7796;BEZERRA COMERCIO DE COMBUSTIVEIS LTDA;nao
7843;FRANCISCA FRANCINILDA FERREIRA TEIXEIRA ME;sim
37309;GRAFICA CAIAPO LTDA ME;sim
7855;DIONISIO RODRIGUES CARDOSO MEI;sim
6107;FRIGO NIARA INDUSTRIA E COMERCIO DE CARNES LTDA;sim
7839;MERCEARIA BRITO LOPES LTDA;sim
7873;WASHINGTON LUIZ LAFAYETTE LOPES RIBEIRO ME;sim
7573;FALCAO PIROTECNIA LTDA ME;sim
7870;LOJAS IPE LTDA;nao
7878;E A CONSTRUCOES COMERCIO E SERVICOS LTDA ME;sim
7560;ISONETE ALVES SILVA MEI;sim
8596;JOAO DA CRUZ DO NASCIMENTO JACINTO ME;sim
8612;LUIZ ROBERTO OLIVEIRA PARISE JAU ME;sim
8604;FONO VIP OTICA E APARELHOS AUDITIVOS LTDA ME;sim
8610;SILVANA BRAZ VIANA ME;sim
8655;C H JACINTO CALCADOS ME;sim
8646;CESAR AUGUSTO FERREIRA DE SOUZA ME;nao
8640;JULIO JANES CARDOSO ME;sim
8642;IRANDYR DOS SANTOS LIMA MEI;sim
8649;CELSO DA SILVA VIDROS ME;sim
8588;C R A ELETRONICA INDUSTRIAL LTDA ME;sim
8652;EDENILSON FERNANDO BUORO ME;sim
8638;JESSICA BEATRIZ CIABOTTI BARBOZA MEI;sim
8633;DROGARIA STOQUE & SIQUEIRA LTDA ME;sim
8619;SIMONE DOS SANTOS CARVALHO MEI;sim
8614;THATI MERCEARIA LTDA ME;sim
8616;IPANEMA INDUSTRIA E COMERCIO LTDA;nao
8621;WANDERLY CARDOSO DE MELO MEI;sim
8635;VNT DISTRIBUIDORA DE SECOS E MOLHADOS LTDA ME;sim
8628;ANDREA CALIL ME;sim
8607;MINIMERCADO JD LTDA ME;sim
8541;ANIBAL DI CAVALCANTI FERREIRA MEI;sim
8488;DIEGO CAUE TEIXEIRA;sim
8683;JANE DE FREITAS PIRES PENNA COMERCIO DE MODA ME;sim
8482;ZAIRA PEREIRA DOS SANTOS MEI;sim
6580;FREDEANA COMERCIO DE COSMETICOS E SERVICOS LTDA ME;nao
8485;EDITORA MARGARITA SCHACK LTDA ME;nao
8490;SAO BENTO COMERCIO DE MEDICAMENTOS E PERFUMARIA LTDA EM RECUPERACAO JUDICIAL;nao
8505;F F DA SILVA PADARIA ME;sim
8499;DABIJU BOLSAS E ACESSORIOS LTDA ME;sim
8477;FRANCISCO FERREIRA DE SOUZA MECANICA ME;sim
8475;ANTONIO PIRES FERREIRA ME;sim
8468;MERCEARIA CALIFORNIA LTDA ME;sim
8466;SANDRA MARIA PEREIRA CONSTRUCAO ME;sim
8470;COMERCIAL MADEIREIRA PIRATININGA LTDA ME;sim
8464;MARIA EVA DE ASSIS SANTOS;sim
8473;AGROVACA DISTRIBUIDORA DE RACOES LTDA;sim
8408;ZENILSON CLEITON CAMARA MEI;sim
8422;COMERCIO DE SOLA ALIANCA LTDA ME;sim
8503;JOAO BATISTA VILA NOVA MEI;sim
8414;CICERO GIRLAN BONIFACIO DE ALENCAR ME;sim
8418;WMC CONSTRUTORA LTDA ME;sim
8426;RODRIGUES DE REZENDE E REZENDE LTDA ME;sim
8451;J L M DE ARAUJO ME;sim
8445;GRACIELE APARECIDA BIAZUS SANTOS ME;sim
8430;CLEONICE RONDON CARRIJO ME;sim
8412;EUNICE A C GARCIA ME;sim
8454;JOAO CARLOS DA SILVA ME;sim
8395;LUCINEIDE DA SILVA HOLANDA MEI;sim
8384;IMPORTADORA E EXPORTADORA GREEN POPS LTDA ME;sim
8391;ANA CLAUDIA REIS DA SILVA MEI;sim
8400;CARLOS PRADINES DE MENEZES JUNIOR ME;sim
8410;JOAO BATISTA GOMES RODRIGUES MEI;sim
8405;SUPERMERCADO RIVIERA LTDA ME;sim
8434;EDMA DA PENHA MACHADO GASPARINI ME;sim
8568;BONONE & OLIVEIRA LTDA ME;sim
8552;ZALEN CALCADOS E ACESSORIOS LTDA ME;sim
8508;GILMARA SILVA DO NASCIMENTO MEI;sim
8544;FABRO & FABRO EPP LTDA;sim
8554;RIO SPORT CONFECCOES EIRELI ME;sim
8585;VISORGLAS VIDROS TEMPERADOS LTDA ME;sim
8564;GRAZIELA COSTA FERNANDES ME;sim
8538;RISONEIDE BATISTA DE OLIVEIRA MEI;sim
8532;A V MARQUES ME;nao
8679;POLYNE ADRIANO RAMOS MEI;sim
8521;DANIEL ALVES DA GAMA MERCEARIA ME;sim
8513;TOTANY LOJA DE CONVENIENCIA LTDA ME;sim
8517;GENESIO CORREIA DA SILVA ME;sim
8525;BOUTIQUE OK EPP LTDA;nao
8459;PEDRO PATRICIO DA SILVA GENEROS ALIMENTICIOS ME;sim
8535;JANAINA SOUZA SOARES MEI;sim
8527;FABIANO DOS SANTOS OFICINA ME;sim
37958;COMERCIAL PELOTAS DE METAIS E PRODUTOS QUIMICOS LTDA ME;nao
37988;DOERNER & CIA EPP LTDA;nao
38024;TV ARATU SA;sim
38012;SANTA TEREZA PESQUIISAS HABITACIONAIS LTDA ME;sim
37955;CENTRAL TELHA INDUSTRIA E COMERCIO LTDA ME;nao
37947;METALURGICA TECNOSTEEL LTDA;sim
37939;SOFAPE FABRICANTE DE FILTROS LTDA;nao
37935;VILAMOVEIS INDUSTRIA E COMERCIO LTDA ME;sim
37941;IONE CARLISE MUELLER ME;sim
37953;MAKIE HATSUTA ME;sim
37943;COMPANHIA SIDERURGICA DO PARA COSIPAR;sim
38017;RADIO GUARUJA PAULISTA LTDA;nao
8774;JUCELINO RAIMUNDO DOS SANTOS ME;sim
2103;LOJAS INSINUANTE SA;nao
38108;PETROLEO BRASILEIRO S A PETROBRAS;nao
38037;RADIO CIDADE EPP LTDA;nao
38130;CB ADMINISTRADORA DE EVENTOS PROMOCIONAIS E SERVICOS LTDA;sim
2765;IGREJA CRISTA MARANATA;nao
820;SUPERGASBRAS ENERGIA LTDA;nao
38102;MARCIA R S P LIMA ME;sim
38084;EMPRESA DE AGUAS CRISS LTDA ME;nao
38043;FUNDACAO PAZ NA TERRA;nao
38041;ELG ASSESSORIA EMPRESARIAL LTDA ME;sim
38066;ASSOCIACAO DE PACIENTES RENAIS DE CATAGUASES APRC;sim
38087;MINALBA ALIMENTOS E BEBIDAS LTDA;nao
38074;EMBAIXADA DA COMUNIDADE DA AUSTRALIA OFICIAL;sim
37911;BOGDAN KAZIMIERZ PIEKOSZEWSKI ME;sim
37980;BENTO MARTINS LOPES MEI;sim
38104;CONSORCIO BM S 66;sim
5912;SERGIO L A DOS ANJOS ME;sim
5849;JOSE ROBERTO DE GOES MEI;sim
5872;J L NUNES PANIFICADORA ME;sim
5835;ANASTACIA C DA ROCHA DOCES FINOS ME;sim
5828;JOSUEL PEREIRA BOMFIM MEI;sim
5832;B CASSIANO COSTA ME;sim
37933;CLABE INDUSTRIA E COMERCIO DE CARROCERIAS LTDA ME;sim
5868;GERTRUDES ANTONIA SOARES CARNEIRO MEI;sim
5889;MARTINS E MARTINS CONFEITARIA LTDA ME;sim
6031;HELLEN MIRAMAR SILVA MEI;sim
