PK_InfoEmpresas;nm_razao_social;fl_matriz
23160;CONDOMINIO ABC SHOPPING CENTER;sim
23155;MOVIMENTO ESTUDANTIL DO BRASIL MEB;nao
22614;CPA PARTICIPACOES SOCIETARIAS LTDA;sim
23195;ASSOCIACAO DOS ADVOGADOS DO IPSEMG;sim
23190;IGREJA UNIVERSAL DO REINO DE DEUS;nao
23193;CENTRO DE UMBANDA CACHOEIRINHA DO XANGO;sim
22235;MARGARETH DA LUZ CORREIA PIRES DE OLIVEIRA MEI;sim
22631;CP 4 CIMENTO PORTLAND SA;sim
23131;LICLUF LIGA CLUBES FESTIVOS;sim
22629;MF DETS PARTICIPACOES LTDA;sim
22237;MUNDAKA INDUSTRIA E COMERCIO DE VESTUARIO LTDA ME;sim
22617;OCEANIC ADMINISTRADORA DE BENS LTDA ME;sim
22619;LINHA VERDE ADMINISTRACAO DE BENS LTDA;sim
23055;IGREJA EVANGELICA MISSIONARIA ASSEMBLEIA DE DEUS MINISTERIO SEMEADORES DE FOGO;sim
5586;JANAINA DE FRAGA REZENDE MEI;sim
23063;GRUPO SOCORRISTA EURIPEDES BARSANULPHO;sim
23057;ASSOCIACAO DOS BUGUEIROS DO MUNICIPIO DE TRAIRI;sim
5608;I A TONHOLO COMERCIO ME;sim
23060;SINDICATO DOS TRAB NO COM HOT BARES REST TUR E HOSP DE SOBRAL E Z NORTE DO CEARA;nao
22708;CLUBE DE INVESTIMENTOS GOOP;sim
23240;ELEICAO 2012 CLAUDIA PATRICIA FLAUSINO VEREADOR;sim
23237;ELEICAO 2012 MARILIA APARECIDA TOMAZ RODRIGUES VEREADOR;sim
23235;ELEICAO 2012 SEBASTIAO JOSCELEI GERMANO VEREADOR;sim
5634;INSUAGRO AGROINDUSTRIAL SA;nao
23233;ELEICAO 2012 RICARDO DOS SANTOS SILVA VEREADOR;sim
23226;ELEICAO 2012 COMITE FINANCEIRO MG UNICO PTC MIRAI;sim
23218;PARTIDO HUMANISTA DA SOLIDARIEDADE PHS;sim
23287;PRP PARTIDO REPUBLICANO PROGRESSISTA;sim
23242;ELEICAO 2012 SILVIO CARLOS MESQUITA SOUZA VEREADOR;sim
23216;ELEICAO 2012 MARIA APARECIDA BATISTA MATOS DE OLIVEIRA VEREADOR;sim
22802;ELEICAO 2012 ANTONIO CARLOS ALVES VEREADOR;sim
23587;SOCIEDADE DE ORTODONTIA DO ESTADO DE ALAGOAS;sim
23623;FRATERNA ASSOCIACAO DE DOIS CORREGOS;sim
23619;PARTIDO SOCIAL DEMOCRATICO;sim
5650;PAES E ALIMENTOS CONGELADOS MT EPP LTDA;nao
23611;PARTIDO TRABALHISTA BRASILEIRO PTB;sim
23291;ASSOCIACAO CARITATIVA E BENEFICENTE A EDUCADORA;nao
23293;ASSOCIACAO DE TRANSPORTE COMPLEMENTAR DE PLANALTO;sim
23222;ELEICAO 2012 MIGUEL SARTORI VICE PREFEITO;sim
5655;C & S PANIFICADORA LTDA ME;sim
5659;DANIELA CORREA CIAMBELLI MEI;sim
23654;PARTIDO REPUBLICANO BRASILEIRO PRB COMISSAO PROVISORIA MUNICIPAL MOMBACA CE;sim
23231;ELEICAO 2012 JOSE EDVALDO RIBEIRO DE SOUZA VEREADOR;sim
23228;SINDICATO RURAL DE XAVANTINA;sim
23224;ELEICAO 2012 CLAUDIONOR LEITE VEREADOR;sim
23656;CLUBE DA PRAIA PRETA;sim
23211;ASSOCIACAO DOS PROPRIETARIOS DE RANCHOS NO POVOADO DO SALOBRA AS MARGENS DO RIO MIRANDA NO MUNICIPIO DE MIRANDA MS;sim
23671;ASSOCIACAO DOS IDOSOS DE NOVA IPIXUNA;sim
23658;ASSOCIACAO COMUNITARIA DO BAIRRO ROSA MISTICA;sim
23649;COMISSAO PROVISORIA PARTIDO DOS TRABALHADORES PT;sim
23263;PARTIDO DA REPUBLICA COMISSAO PROVISORIA MARIBONDO;sim
23244;ASSOCIACAO DOS MINI E PEQ PROD DA ALDEIA CONCEICAO;sim
23652;ELEICAO 2012 MARIA APARECIDA DA SILVA BEZERRA VEREADOR;sim
23279;IGREJA PRESBITERIANA DE MAUA;sim
23284;ASSOCIACAO MISSIONARIA EBENEZER;sim
23646;PARTIDO TRABALHISTA DO BRASIL;sim
23282;UNIAO DOS MORADORES DE PONTAS DE PEDRA;sim
22839;COMISSAO PROVISORIA DO DEMOCRATAS DE SANTA RITA DO ARAGUAIA;sim
23635;ASSOCIACAO EVANGELICA BENEFICENTE E PROMOCIONAL BETE SALEM;sim
23643;CLUBE DE ENGENHARIA DE BARBACENA;sim
23638;LIGA BOQUEIRAOENSE DE FUTEBOL;sim
23258;IGREJA MUNDIAL DO PODER DE DEUS;nao
23640;ELEICAO 2012 MANOEL DE SOUSA VEREADOR;sim
23403;ELEICAO 2012 SONIA MARGARET SOARES LIMONTA VICE PREFEITO;sim
23387;COMUNIDADE APOSTOLICA O ELO DA BENCAO;sim
10747;MARIA RAQUEL MELOTTI TRANSPORTES ME;sim
10760;ELBIA ALVES FREITAS TEIXEIRA ME;sim
22816;COMISSAO PROVISORIA MUNICIPAL DO PARTIDO SOCIALISTA BRASILEIRO DE WANDERLANDIA TO;sim
9743;MARIA LINDACI RIBEIRO DOS SANTOS MEI;sim
9750;ZENILDA MEDEIROS DOS SANTOS ME;sim
22842;PARTIDO POPULAR SOCIALISTA;sim
22725;MB INVESTIMENTOS E CONSULTORIA LTDA ME;sim
9746;D D GEIK ME;sim
22702;SIRO PARTICIPACAO E ADMINISTRACAO DE BENS LTDA;sim
22700;CLUBE DE INVESTIMENTO TUPI;sim
10932;STUHR AGROPECUARIA LTDA;nao
22696;R R VALE DO RIBEIRA LOCACAO DE BENS E EQUIPAMENTOS SA;sim
22698;VO TINO PARTICIPACOES LTDA;sim
22717;R G F PARTICIPACOES LTDA;sim
22772;ASSOCIACAO COMUNITARIA RADIO BOAS NOVAS;sim
23681;CONSELHO ESCOLAR DA ESCOLA MUNICIPAL NADIR COLACO;sim
23684;PARTIDO SOCIAL DEMOCRATA CRISTAO PSDC VILA VALERIO;sim
22762;ASSOCIACAO DOS PEQUENOS TRABALHADORES ORGANIZADOS DO PROJETO DE ASSENTAMENTO TODOS OS SANTOS I;sim
22769;ELEICAO 2012 ROZILEIDE ALVES DA SILVA VEREADOR;sim
23679;ELEICAO 2012 ALESANDRO MARQUES CALIXTO VEREADOR;sim
23688;PARTIDO PROGRESSISTA;sim
5680;V M SABOR LTDA ME;sim
23319;ELEICAO 2012 JOAO TEIXEIRA FONSECA VEREADOR;sim
23311;ELEICAO 2012 WILSON MARINHO DE CARVALHO VEREADOR;sim
23309;ASSOCIACAO NOVA UNIAO DOS PEQUENOS HORTIFRUTICULTORES DO SETOR INDUSTRIAL;sim
23304;ASSOCIACAO UNIDA DOS FOGUETEIROS E PIROTECNICOS DO ESTADO DE SERGIPE;sim
23316;ASSOCIACAO COMUNITARIA DE LAGEDO DE BAIXO;sim
5645;CARLOS ANTONIO DE SOUZA BARBOSA ME;sim
23298;VILA CRIAR;sim
23666;CAIXA ESCOLAR RUI PALMEIRA;sim
23296;CENTRO MUNICIPAL DE EDUCACAO INFANTIL ESTRELA GUIA;sim
23302;MOVIMENTO FEMININO EM DEFESA DA PESSOA PORTADORA DE DEFICIENCIA MFD;sim
23368;ELEICAO 2012 PEDRO SOUZA LIMA VEREADOR;sim
23356;INSTITUTO KARIUS;sim
23349;ELEICAO 2012 VILMAR HELIO COSTA VICE PREFEITO;sim
23366;INSTITUTO SAUDE BRASIL;sim
23347;ELEICAO 2012 VALDEMIR MASCIA VEREADOR;sim
22784;ASSOC DE APOIO ESCOLAR DA CRECHE ESPIRITA PRE ESCOLA MARIA MADALENA;sim
23321;ELEICAO 2012 GILVAN DANTAS DE MENDONCA VEREADOR;sim
23323;ELEICAO 2012 VOLNEI DE BORBA GOMES PREFEITO;sim
23345;ELEICAO 2012 JOAO ROBSON FRANKLIN CAVALCANTE FILHO VEREADOR;sim
22798;CASA DE ORACAO PETENCOSTAL DOS AFASTADOS;sim
23342;PARTIDO REPUBLICANO BRASILEIRO PRB STA HEL DE MINAS COMISSAO PROVISORIA;sim
23335;ELEICAO 2012 JOSE GASPAR FERREIRA DE CASTRO VEREADOR;sim
23289;CENTRO ACADEMICO DE ECONOMIA CELSO FURTADO;sim
23690;IGREJA EVANGELICA ASSEMBLEIA DE DEUS;sim
23696;ASSOCIACAO DE DEFESA DOS CONTRIBUINTES DO DISTRITO FEDERAL ASDECONT DF;sim
5684;ROBERTA CRISTINA LOSCHER MEI;sim
23693;ASSOCIACAO COMUNITARIA DO SITIO GATO;sim
23719;ASSOCIACAO COMUNITARIA VAMOS CONSTRUIR ESPIGAO ALTO DO IGUACU;sim
23771;PARTIDO HUMANISTA DA SOLIDARIEDADE PHS COMISSAO PROVISORIA MUNICIPAL DE ITAMARANDIBA MG;sim
23734;ASSOCIACAO DE PAIS E PROFESSORES DAS EMEI S DE ITAPIRA;sim
23790;CMTI CLUBE DA MEDIA E TERCEIRA IDADE;sim
23711;ELEICAO 2012 DEBORA CRISTINA MOREIRA VEREADOR;sim
23738;ELEICAO 2012 PAULO SILVA VEREADOR;sim
23784;PARTIDO VERDE COMISSAO PROVISORIA MUNICIPAL DE BUENOPOLIS;sim
23769;PARTIDO COMUNISTA DO BRASIL DIRETORIO MUNICIPAL;sim
23763;PARTIDO DOS TRABALHADORES;nao
23814;CASA DE BELEM DE VOTORANTIM;nao
23801;CORDAO DA CONFRARIA DO PERU SADIO;sim
23776;ASSOCIACAO DOS PEQUENOS PRODUTORES RURAIS DO JURUNAS;sim
5667;DANIELA SCACIOTTA GONCALVES ME;sim
5693;TATIANE SANTOS DA CONCEICAO MEI;sim
23736;CASA DE CARIDADE FRANCISCO DE ASSIS;sim
23774;IGREJA EVANGELICA PENTECOSTAL O SENHOR E A NOSSA JUSTICA;sim
5690;INDUSTRIA E COMERCIO DE LATICINIOS PANDA LTDA ME;sim
23708;IGREJA EVANGELICA MINISTERIO CASA DE DAVI;sim
23732;BLOCO CARNAVALESCO MISTO FLOR DA LIRA DE OLINDA;sim
23744;ELEICAO 2012 JOSE CARLOS ROBERTO VEREADOR;sim
23759;ASSOCIACAO DOS MOTOQUEIROS DA COXILHA VELHA TRILHEIROS TA TRI;sim
23756;DIRETORIO MUNICIPAL DO PARTIDO DOS TRABALHADORES DE TANQUE NOVO;sim
23750;ELEICAO 2012 JOAO BATISTA MATOS VEREADOR;sim
23740;ASSOCIACAO DOS PEQUENOS PRODUTORES RURAIS DO POVOADO BELA VISTA;sim
23746;ELEICAO 2012 MARIA ELIZABETH DUARTE MAGALHAES VEREADOR;sim
23752;CENTRO ESPIRITA LUZ E CARIDADE;sim
23699;ANACIC ASSOCIACAO NACIONAL DOS CICLISTAS;sim
23702;ASS DE PAIS E PROF DA ESCOLA EVARISTO DA VEIGA;sim
23754;IGREJA EVANGELICA CONGREGACIONAL DE UTINGA;sim
23748;PARTIDO DA REPUBLICA COMISSAO PROVISORIA MUNICIPAL;sim
23730;ELEICAO 2012 LUIZ MARINO COSTA VEREADOR;sim
23722;COMUNIDADE EVANGELICA DE ARCO IRIS;sim
23724;IGREJA TENRIKYO HOYO DO BRASIL;sim
23781;INSTITUTO MEDALHA DOURADA IMD;sim
23761;ASSOCIACAO DO GRUPO DE JOVENS LUZ DA JUVENTUDE DO MUNICIPIO DE VARGEM GRANDE MA;sim
23714;CAIXA ESCOLAR PAULO GOMES;sim
23716;APP ASSOCIACAO DE PAIS E PROFESSORES;sim
23779;PARTIDO COMUNISTA DO BRASIL DA CIDADE DE BARREIRA CE;sim
23705;ASSOCIACAO DE CAPOEIRA GUAIAMUS VILA VELHA ES;sim
23794;ASSOCIACAO DE AMPARO E VALORIZACAO DA VIDA AVYVA;sim
23786;SIND DOS SERVIDORES PUBL MUNICIPAIS DE CRUZ DO OESTE;sim
23198;SINDICATO DAS EMPR DE TRANSP DE CARGAS DE PIRACICABA;sim
23209;ELEICAO 2012 EDMELIA DO NASCIMENTO CARVALHO VEREADOR;sim
23202;COMUNIDADE EVANGELICA SARA NOSSA TERRA;nao
23206;ASSOCIACAO DAS FAMILIAS AGROECOLOGICAS DE OTACILIO COSTA;sim
5708;LATICINIOS INDAIATUBA LTDA ME;sim
23862;ASSOCIACAO COMUNITARIA DO MORRO ALTO;sim
23866;ELEICAO 2012 DEUSENILIA DE JESUS FONSECA VEREADOR;sim
23265;UNIAO DOS MOVIMENTOS DE MORADIA DO TOCANTINS UMM TO;sim
23868;ASSOCIACAO COMUNITARIA NOVA TERRA;sim
23824;SINDICATO DOS EMPREGADOS NO COMERCIO DE CONSELHEIRO LAFAIETE E REGIAO;sim
23267;CONDOMINIO EDIFICIO ARGOS;sim
23675;ASSOCIACAO DE PAIS E MESTRES DA E M E F ANTONIO PACIFICO;sim
23664;ELEICAO 2012 DIRCEU RAMOS MANTOVANI VEREADOR;sim
23250;AMAP ASSOCIACAO DOS MEDICOS AUDITORES DE PERNAMBUCO;sim
23662;ASSOCIACAO DOS TRABALHADORES RURAIS DO P A VEREDAS II;sim
23660;ASSOCIACAO ORNITOLOGICA DE OURO BRANCO;sim
23260;IRMANDADE DO SS SACRAMENTO CATEDRAL DE MACEIO;sim
23253;MITRA DIOCESANA DE PETROPOLIS;nao
23271;ASSOCIACAO DOS RODOVIARIOS APOSENTADOS E PENSIONISTAS DE MINAS GERAIS ARAPMG;sim
23864;CONSELHO CENTRAL SAGR COR DE JESUS DA SOC DE S V DE PAULO DE CONSELHEIRO LAFAIETE;sim
23255;ASSOCIACAO DA IGREJA METODISTA 1 REGIAO ECLESIASTICA;nao
23247;PAROQUIA CATEDRAL DE SANTO ANTONIO;sim
5719;INDUSTRIA E COMERCIO DE BISCOITOS DOCE DELICIA EPP LTDA;sim
23806;COMISSAO PROVISORIA MUNICIPAL DE JANDAIA DO SUL DO DEM;sim
23798;PARTIDO LIBERAL PL DIRETORIO MUNICIPAL DE SUCUPIRA;sim
23796;GRUPO DE AUX AO MENOR EST FUNDACAO DO BEM ESTAR DO MENO;sim
23811;ELEICAO 2012 ROMILDO OSCAR DA SILVA VEREADOR;sim
23808;ASSOCIACAO FAMILIAR DOS AGRICULTORES VASCONCELOS PRUDENCIO;sim
23816;PARTIDO POPULAR SOCIALISTA PPS;sim
23820;ACAO SOCIAL DA DIOCESE DE CAJAZEIRAS;nao
23856;ASSOCIACAO AMIGOS DO HOSPITAL UNIVERSITARIO DA UNIVERSIDADE FEDERAL DE SANTA CATARINA;sim
23844;SINDICATO DOS SERVIDORES PUBLICOS MUNICIPAIS DE MANTENOPOLIS ES SISPMAN;sim
23842;ELEICAO 2012 MARISTELA ZANELLA RIBEIRO VEREADOR;sim
23840;ELEICAO 2012 JULCIMAR ZILLI VEREADOR;sim
23848;IGREJA PENTECOSTAL JESUS FONTE DE AGUAS VIVA;sim
23859;ASSOC CRISTA DE SOC AO MEN CAR A REC DO NAZ DAS MIS NAZ;sim
23850;SINDICATO DOS MEDICOS DO VALE DO ACO;sim
23766;ASSOCIACAO DE PRODUTORES ORGANICOS DE MATO GROSSO DO SUL;sim
23853;ASSOCIACAO DOS TECNICOS AGRICOLAS DO MEIO OESTE CATARINENSE;sim
23837;IGREJA ASSEMBLEIA DE DEUS AGNUS DEI MINISTERIO UNCAO E VERDADE;sim
23835;ELEICAO 2012 COMITE FINANCEIRO CE PARA VEREADOR PRP MORRINHOS;sim
23833;ELEICAO 2012 JOCIMAR ALVES BRANDALISE VEREADOR;sim
23831;PARTIDO LIBERAL DE LUISBRUGO MG;sim
23827;ELEICAO 2012 VAGNER AMENDOLA MOLEIRO VEREADOR;sim
23829;MITRA DIOCESANA DA CAMPANHA;nao
23214;ELEICAO 2012 JARDANIA RAMOS BEZERRA SA VEREADOR;sim
23885;PAROQUIA NOSSA SENHORA DAS MERCES;sim
22865;ASSOCIACAO COMUNITARIA DOS TRABALHADORES RURAIS DO LOTEAMENTO LUIS SARAIVA;sim
23919;ASSOCIACAO AMIGOS DA CAPOEIRA;sim
23905;ASSOCIACAO ARROIO FUTEBOL CLUBE;sim
23921;COMUNIDADE EVANGELICA LUTERANA;sim
23936;A B A V J S ASSOCIACAO BENEFICIENTE AMIGOS VOLUNTARIOS DE JARAGUA DO SUL;sim
23941;GRUPO ESPIRITA ANDRE LUIZ;sim
23943;UNIDADE EXECUTORA DA ESCOLA MUNICIPAL MARCELINO ZAIDAN;sim
24054;ASSOCIACAO DAS OPERADORAS DE RECEPTIVO DE SAO PAULO;sim
23933;CENTRO ESPIRITA CABOCLO TUPINAMBA;sim
23929;ASSOCIACAO CULTURAL MARIA MAIA DE AQUINO;sim
22905;ASSOCIACAO COMUNITARIA DE RADIODIFUSAO NOVOS TALENTOS;sim
22847;ASSOCIACAO DOS AMIGOS PARA O DESEMVOLVIMENTO DA BACIA LEITEIRA DA REGIAO DOS COCAIS ADBL;sim
22859;ASSOCIACAO DOS MORADORES E AGRICULTORES DE AREIA DE CHATINHA;sim
22857;ELEICAO 2012 BENONI GRAPP FILHO VEREADOR;sim
22855;ELEICAO 2012 JOAQUIM LEITAO FARIAS CAVALCANTE VEREADOR;sim
24056;MOVIMENTO MARIAL VICENTINO DA PROVINCIA DO RECIFE;sim
23931;GRUPO CULTURAL FILOMENA FORROZERA;sim
23938;ELEICAO 2012 PEDRO RODRIGUES DA SILVA VEREADOR;sim
23891;CONGREGACAO EVANGELICA LUTERANA SAO LUCAS;sim
23874;MITRA DIOCESANA DE SANTO ANDRE;nao
24059;DEMOCRATAS DEM;sim
24015;ELEICAO 2012 VALDECIR FURIO VEREADOR;sim
24047;ASSOCIACAO COMUNITARIA DO POVOADO PROGRESSO II;sim
24005;CENTRO DE APOIO A MULHER GRUPO DE INTEGRAO SOCIAL;sim
24019;ASSOCIACAO JOVENS VERDES DO ESTADO DE SAO PAULO;sim
23978;ELEICAO 2012 JOSE ALFREDO NETO GONZAGA DE OLIVEIRA VEREADOR;sim
24044;ASSOC DE PAIS MESTRES E FUNCIONARIOS DO COL EST JOSE BONIF ENSINO FUND E MEDIO;sim
24050;CONSELHO DA CRECHE COMUNITARIA CANTINHO DA IMAGINACAO;sim
24052;COMISSAO PROVISORIA PARTIDO POPULAR SOCIALISTA PPS;sim
23949;APM DA EMM JOAQUIM SOARES;sim
24042;COMISSAO PROVISORIA DO PARTIDO DOS TRABALHADORES DE JOAQUIM FELICIO PT DE JOAQUIM FELICIO;sim
24067;ELEICAO 2012 ADRIANO RODRIGUES DOS SANTOS VEREADOR;sim
24089;ASSOCIACAO COMUNITARIA ARIRI INDEPENDENCIA ACAI;sim
24092;ASSOCIACAO ABASTECEDORA DE AGUA DE LINHA RINCAO DE SOUZA;sim
24097;ASSOCIACAO DOS PORTADORES DE DEFICIENCIA DE IPATINGA;sim
24095;DIRETORIO DO PARTIDO DOS TRABALHADORES PT;sim
24099;ASSOCIACAO DOS MORADORES DA VILA RESIDENCIAL DE ESTREITO;sim
23982;DIRETORIO MUNICIPAL DO PARTIDO DA REPUBLICA PR;sim
24084;COMUNIDADE CANCAO NOVA ASSOCIACAO INTERNACIONAL PRIVADA DE FIEIS;nao
24078;COMISSAO PROVISORIA MUNICIPAL DEMOCRATAS DEM DE SITIO NOVO DO TOCANTINS TO;sim
24063;CAIXA ESCOLAR PROFESSORA AMELIA GUIMARAES;sim
24082;NUCLEO DE CRIADORES DE CAVALO CRIOULO DO PLANALTO NORTE CATARINENSE;sim
22732;ARAUCARIA PARTICIPACOES E INVESTIMENTOS SA;sim
23880;ASSOCIACAO COMUNITARIA DO SITIO LAGOA REDONDA;sim
23990;FUNDACAO VALE DO PIRANHAS FUMVAP;sim
23972;ELEICAO 2012 MAIKON DE FREITAS TAVARES VEREADOR;sim
23966;CAETES EMPREENDIMENTOS E PARTICIPACOES LTDA;sim
23970;COMISSAO PROVISORIA MUNICIPAL DO PARTIDO PROGRESSISTA PP DE VESPASIANO MG;sim
23992;ASSOCIACAO DE PAIS MESTRES E FUNCIONARIOS DO COLEGIO ESTADUAL TEREZINHA LADIR DE OLIVEIRA;sim
23914;PARTIDO RENOVADOR TRABALHISTA BRASILEIRO PRTB;sim
24017;ASSOCIACAO COMUNITARIA DA LOCALIDADE DE BONITO;sim
24003;COMUNIDADE EVANGELICA ALTAR DA PROMESSA;sim
23974;ELEICAO 2012 VERA LUCIA SOARES VEREADOR;sim
22827;MITRA DIOCESANA DE FREDERICO WESTPHALEN;nao
23959;COMISSAO P DESENVOLVIMENTO DAS C DO DIST DE ROMEOPOLIS;sim
22829;PP PARTIDO PROGRESSISTA;sim
22808;ELEICAO 2012 GERALDO FLAVIO DE ANDRADE PREFEITO;sim
22806;ELEICAO 2012 ZENOBIO TOSCANO DE OLIVEIRA PREFEITO;sim
22810;CENTRO ESPIRITA FONTE VIVA;sim
22813;ELEICAO 2012 FERNANDO ANTONIO DA SILVA CORDEIRO VEREADOR;sim
22824;COMISSAO PROVISORIA PARTIDO TRABALHISTA BRASILEIRO PTB;sim
22832;IV IGREJA BATISTA DE GOIANIA;nao
23955;SOMAPI SOCIEDADE MACONICA PRO IDOSO DO RIO GRANDE DO NORTE;sim
24011;ELEICAO 2012 ANTONIO MARTINS VIEIRA VEREADOR;sim
22837;ASSOCIACAO DE ARTESANATO PROJETO ARTEMANHAS;sim
22834;ASSOCIACAO DOS GUARDAS MUNICIPAIS DE CURITIBA PR;nao
24013;COMISSAO PROVISORIA PARTIDO SOCIAL DEMOCRATA CRISTAO PSDC IBATIBA ES;sim
24023;ASSOCIACAO CAMPUS UNIPAZ SUL;nao
24009;PARTIDO COMUNISTA BRASILEIRO PCB COMISSAO PROVISORIA MUNICIPAL DE BACABAL;sim
23996;ELEICAO 2012 ROBERTO DOS ANJOS SILVA VEREADOR;sim
23988;CONSELHO DE PAIS E MESTRES DA UNIDADE ESCOLAR ARACI LUSTOSA;sim
24007;IGREJA BATISTA ALVORADA;sim
5725;PAULO SANTOS ANDRADE ME;sim
23980;CONVENCAO DAS ASSEMBLEIAS DE DEUS MINISTERIO UNIAO NO ESTADO DO TOCANTINS;sim
23957;ELEICAO 2012 WELINGTON LAZARO BATISTA VEREADOR;sim
23998;MITRA ARQUIDIOCESANA DE SAO PAULO;nao
23894;ELEICAO 2012 MARCIA MARIA DA SILVA VEREADOR;sim
23903;CENTRO ASSISTENCIAL DE SAUDE DE BARRA LONGA CASA;sim
24001;PARTIDO SOCIAL DEMOCRATA CRISTAO;sim
23952;ESCOLINHA ESPORTE CLUBE TRANSBATISTA;sim
23889;ASSOCIACAO DE PAIS MESTRES E FUNCIONARIOS APMF DA ESCOLA MUNICIPAL EM TEMPO INTEGRAL HUGO PEREIRA CORREA;sim
23901;ELEICAO 2012 JOSE DA SILVA LEAL VEREADOR;sim
23899;ELEICAO 2012 WALDEMAR BARBOSA DO REGO VEREADOR;sim
23877;ASSOCIACAO DOS SERVIDORES DO INCRA DOURADOS MT;sim
23882;SIND DO COM VAREJ DE GENEROS ALIMENT NO ESTADO DO PARA;sim
23927;IGREJA PENTECOSTAL CHAMA DO ESPIRITO SANTO;sim
23945;ELEICAO 2012 GILBERTO LUIZ DE ALCANTARA VICE PREFEITO;sim
23870;ELEICAO 2012 MAURICIO CIRICO VEREADOR;sim
23976;ELEICAO 2012 MARIANO BATISTA GOMES VEREADOR;sim
22821;COMISSAO PROVISORIA MUNICIPAL DO PARTIDO LIBERAL DE AMONTADA;sim
24112;ELEICAO 2012 LIDIA HERECK MARCOS VEREADOR;sim
24204;ASSOCIACAO COMUNITARIA DE MULHERES DE LAGOA GRANDE;sim
24202;COMISSAO PROVISORIA MUNICIPAL DO PSC APODI RN;sim
24207;ASSOCIACAO COMUNITARIA DE DOIS LAJEADOS;sim
24114;ELEICAO 2012 MARIA AUXILIADORA DO NASCIMENTO VEREADOR;sim
24216;ASSOCIACAO DE SERVICOS COMUNITARIOS DE ROCADINHO;sim
24212;ELEICAO 2012 DIONISIO CARLOS FERNANDES VEREADOR;sim
24171;SERRA CLUBE DE CAICO;sim
24168;ASSOCIACAO BENEFICENTE DAS FAMILIAS CARENTES DE ELDORADO DO CARAJAS;sim
5751;MARILENE LUIZA PECLA MEI;sim
24175;JOSE IVANILDO BARBOSA;sim
24184;CAIXA ESCOLAR CRECHE MUNICIPAL MAE JOVINA;sim
24186;COMISSAO PROVISORIA DO PARTIDO DA SOCIAL DEMOGRACIA BRASILEIRA PSDB;sim
24180;IGREJA EVANGELICA ASSEMBLEIA DE DEUS MINISTERIO DE MADUREIRA;sim
24177;IGREJA EVANGELICA ASSEMBLEIA DE DEUS MINISTERIO TENDA DOS MILAGRES MG;sim
24101;PARTIDO SOCIALISTA BRASILEIRO;sim
24061;ASSOCIACAO OS PEQUENOS CONTADORES DE HISTORIAS APCH;sim
24165;ASSOCIACAO DOS MORADORES DO BAIRRO FAZENDA CURUPEBA AMBFC;sim
24163;PARTIDO DA SOCIAL DEMOCRACIA BRASILEIRA PSDB DO MUNICIPIO DE SIMAO DIAS;sim
24200;ASSOCIACAO DOS PEQ PROD RURAIS DO MUCAMBO DOS BOIS;sim
24209;ASSOCIACAO DE DESENVOLVIMENTO COM DO BOM PRINCIPIO VELHO;sim
24142;CENTRO ACADEMICO MEDICINA UNIPLAC CESARE SARTORI CAMUNCS;sim
22711;CB PARTICIPACOES LTDA;sim
22692;ITAU UNIBANCO SA;nao
22713;BM FACTORING E FOMENTO COMERCIAL EPP LTDA;sim
5571;ALCINDA MARGARIDA NASS BARRETO MEI;sim
22751;QUARTZO EMPREENDIMENTOS E PARTICIPACAO LTDA;sim
22862;COMISSAO PROVISORIA PARTIDO POPULAR SOCIALISTA PPS NOVA LARANJEIRAS PR;sim
22715;BRADESCO CORPORATE EXCLUSIVO FUNDO DE INVESTIMENTO EM COTAS DE FUNDOS DE INVESTIMENTO RENDA FIXA PGBL VGBL;sim
22868;ELEICAO 2012 ANTONIO SOARES PEREIRA VEREADOR;sim
22850;ASSOCIACAO DOS MUTUARIOS E CONSUMIDORES DE CONTAGEM ASMUC;sim
22899;COMISSAO PROVISORIA DO PARTIDO TRABALHISTA NACIONAL PTN;sim
22853;COMISSAO PROVISORIA MUNICIPAL DO PARTIDO HUMANISTA DA SOLIDARIEDADE PHS;sim
24214;ELEICAO 2012 ROSEMARY SOUSA VIEIRA VEREADOR;sim
24156;ELEICAO 2012 MARIA RITA RIBEIRO DE SOUSA VEREADOR;sim
24144;IGREJA PRESBITERIANA EM PLANALTINA;sim
24158;ASSOCIACAO DOS SERVIDORES PUBLICOS E APOSENTADOS DO MARANHAO;sim
24161;COMISSAO PROVISORIA DO PARTIDO SOCIAL DEMOCRATICO PSD DE JARDIM DO SERIDO;sim
24152;DIRETORIO MUNICIPAL DO PARTIDO DO MOVIMENTO DEMOCRATICO BRASILEIRO PMDB DO MUNICIPIO DE SERRANO DO MARANHAO;sim
5763;PAULO ROBERTO DE CARVALHO S A PARAISO ME;sim
24149;ASSOCIACAO COMUNITARIA DOS PEQUENOS PRODUTORES RURAIS DE BARRINHA;sim
24193;IGREJA MINISTERIO INTERNACIONAL ADORADORES DO REI;sim
24154;PARTIDO DO MOVIMENTO DEMOCRATICO BRASILEIRO PMDB COMISSAO PROVISORIA;sim
24198;COMUNIDADE MAR A DENTRO;sim
24196;NUCLEO ESPIRITA A CAMINHO DA LUZ;sim
23962;ASSOC DE DESENVOLVIMENTO COMUNITARIO DE MARCIANOPOLIS;sim
24027;IGREJA PENTECOSTAL DEUS E AMOR;nao
23947;COMISSAO PROVISORIA DO PARTIDO VERDE;sim
23984;PARTIDO DA SOCIAL DEMOCRACIA BRASILEIRA DIRETORIO MUNICIPAL SERRA ALTA SC;sim
24025;ELEICAO 2012 SIMONE CRISTINA DE ALMEIDA VEREADOR;sim
24031;APM DA EM SHOZAYEMON SETOKUCHI;sim
24035;ASSOCIACAO DOS PRODUTORES RURAIS DO RINCAO DOS MENEZES;sim
23872;A P M DA E E PROF AYRES DE MOURA;sim
5767;ROGERIO ROCHA TEIXEIRA ME;sim
24189;PARTIDO SOCIAL DEMOCRATICO PSD DIRETORIO MUNICIPAL;sim
23908;NUCLEO DE ESTUDOS DA PROSTITUICAO;sim
24037;CENTRO ESPIRITA ESCOLA EVANGELICA JESUS CRISTO;nao
24033;IGREJA EVANGELICA ASSEMBLEIA DE DEUS EM PINDAMONHANGABA;nao
5733;AGUA DOCE PESCADOS INDUSTRIA E COMERCIO EIRELI ME;sim
23963;ASSOCIACAO DOS CONCESSIONARIOS E PERMISSIONARIOS DO MERCADO PUBLICO MUNICIPAL NELSON SANTOS ACOPEMEP;sim
24071;ELEICAO 2012 EUGENIO ANTUNES CORREIA VEREADOR;sim
23912;ELEICAO 2012 DOUGLAS GUSTAVO PONTES VEREADOR;sim
24087;ELEICAO 2012 JOSE SANTANA SOBRINHO VEREADOR;sim
24069;INSTITUTO MARCEL FURLAN;sim
24073;ELEICAO 2012 ERANDY FERREIRA CASTRO VICE PREFEITO;sim
23910;COMISSAO PROVISORIA DO PARTIDO POPULAR SOCIALISTA PPS;sim
23917;ASSOCIACAO COMUNITARIA DOS MORADORES E AMIGOS DO BAIRRO VALE DOS PEOES;sim
24080;PARTIDO DEMOCRATAS EM SANTA LUZIA;sim
24116;ELEICAO 2012 ALCIDEA DE CARVALHO PEREIRA VEREADOR;sim
24110;ELEICAO 2012 JOSE MARIA PEREIRA DA SILVA VEREADOR;sim
24122;ELEICAO 2012 COMITE FINANCEIRO CE UNICO PSD PEDRA BRANCA;sim
24118;MITRA DIOCESANA DE CARAGUATATUBA;nao
24120;COMISSAO PROVISORIA DO PARTIDO POPULAR SOCIALISTA PPS NO MUNICIPIO DE AMARANTE;sim
24191;CONSELHO DELIBERATIVO ESCOLAR DA ESCOLA MUNICIPAL SOTECO;sim
24218;ASSOCIACAO DE PAIS E PROFESSORES DA ESCOLA REUNIDA MUNICIPAL PROFESSOR JOAO MANOEL DA SILVA;sim
24108;ASSOCIACAO PILARENSE DE RADIODIFUSAO COMUNITARIA;sim
24106;MECA MOVIMENTO ESPIRITA CAMINHEIROS NO AMOR;sim
24103;IGREJA PRESBITERIANA DO BRASIL EM JOAO NEIVA;sim
24136;SIND DOS MOTORISTAS CONDUT DE VEIC RODOV URBANOS E EM GERAL TRAB TRANSP ROD PBCO;nao
24221;IGREJA BATISTA PENTECOSTAL DO AVIVAMENTO;sim
24226;ASSOCIACAO PARANAENSE DOS DISTRIBUIDORES E IMPORTADORES DE PRODUTOS CIRURGICOS E IMPLANTES;sim
24124;ELEICAO 2012 MARIA CANDIDO DA SILVA SOUZA VEREADOR;sim
5771;MARIA DE LOURDES DA SILVA MEI;sim
24224;DIRETORIO MUNICIPAL DO PPB EM MARITUBA;sim
24139;MULHERES UNIDAS DE SAO PEDRO;sim
24134;ELEICAO 2012 LUIZ ALVES FEITOZA VEREADOR;sim
24131;GRUPO DA FRATERNIDADE ESPIRITA HILARIO SILVA;sim
24075;ASSOCIACAO BENEFICENTE DA ASSEMBLEIA DE DEUS DE PORTO FERREIRA;sim
24126;ASSOCIACAO DOS AGRICULTORES AGUA VIVA;sim
24129;ELEICAO 2012 MARIA IRACI DA ROCHA GREGORIO VEREADOR;sim
22342;MICHELLE CAMPOS CARUSO MEI;sim
24235;J S MORAES EPP ME;sim
24335;CONSTRUTORA EXATA LTDA ME;sim
24323;CONSTRUTORA PONTAGROSSENSE LTDA ME;sim
24318;M B PINTURAS E EMPREITEIRA LTDA ME;sim
24425;GILBERTO ALMEIDA SANTOS DE JEQUIE ME;sim
24326;PORTERRA CONSTRUTORA LTDA;sim
24339;TRENA CONSTRUCAO E COMERCIO LTDA ME;sim
24558;JOAO ASSIS DE ALENCAR ME;sim
24302;COOP DE HAB E INF RURAL DA A F ASSET DA REF A E C T LTDA;sim
24308;KVA SERVICOS ELETRICOS LTDA ME;sim
5788;INDUSTRIA E COMERCIO DE ALIMENTOS LIDERANCA LTDA ME;nao
24314;PREMAR PREMOLDADOS MARECHAL EPP LTDA;sim
24420;ESTEFANO R MORGADO ME;sim
24428;MIRANDA EMPREENDIMENTOS IMOBILIARIOS LTDA ME;sim
24431;PRADO & PAULA ENGENHARIA E CONSTRUCOES EPP LTDA;sim
24456;REGRA SISTEMA NA CONSTRUCAO LTDA;sim
24462;TEMPO CONSTRUTORA LTDA ME;sim
24232;AMBIENTAL CONSTRUCOES E SERVICOS LTDA ME;sim
5778;JANETE AZEVEDO BRAMONT MEI;sim
24360;TEC TERRA CONSTRUCAO LTDA;sim
24346;CONSTRUTORA CONNAGE LTDA ME;sim
24402;CONSTRUTORA FARDIN LTDA ME;sim
24405;BISPO E BISPO LTDA ME;sim
24408;M M M SERVICOS LTDA ME;sim
24379;JOSE EVERALDO DE ALBUQUERQUE;sim
24371;WTC CONSTRUTORA LTDA ME;sim
5795;DAMIAO DE OLIVEIRA MELO ME;sim
24564;ENGESIQUE ENGENHARIA CONSTRUCOES E MONTAGENS LTDA;sim
24909;SIT ENGENHARIA SA;nao
24969;M V S SERVICOS DE MANUTENCAO E PINTURA LTDA ME SS;sim
24951;ANTONIO MAURO GUERRA;sim
24566;ANDARES ENGENHARIA LTDA ME;sim
25103;R O DA SILVA ME;sim
24572;R & C TRANSPORTES LTDA ME;sim
25314;COSME DE SOUSA SANTOS ME;sim
25321;CARTEJANNE CUNHA FIGUEREDO ME;sim
25308;GRAU PROJETOS EDIFICACOES E EMPREENDIMENTOS LTDA ME;sim
24519;KAUS & KAUS LTDA;sim
24686;CONSTRUTORA NORTEBEL LTDA ME;sim
24507;CONSTRUTORA PRIMAVERA LTDA ME;sim
24716;CONSTRUTORA C L C LTDA ME;sim
24277;WELITON JOSE RIBEIRO ME;sim
24248;ECCL EMPREENDIMENTOS E CONSTRUCAO CIVIL LTDA;sim
24279;MAC CONSTRUTORA LTDA ME;sim
24731;CONSTRUTORA COLISEU LTDA;sim
24240;PROJINOX INDUSTRIA E COMERCIO EIRELI EPP;sim
24291;CONSTRUTONA CONSTRUTORA LTDA ME;sim
24526;NEUSA BORGES ASSUNCAO ME;sim
24711;E M I EMPRESA DE MONTAGEM E INSTALACOES LTDA;sim
24578;KW DO BRASIL LTDA;nao
24486;CONSTRUTORA QUEIROZ MARTINS EPP LTDA;sim
24708;EMPREITEIRA FREITAS E PACHECO LTDA ME;sim
24694;M C M ENGENHARIA CONSTRUCOES LTDA ME;sim
24492;RODRIGO SOUZA AURELIANO TELECOMUNICACOES ME;sim
24228;ASSOCIACAO DOS SERV DO DEPTO DE ESTRADAS DE RODAGEM;nao
25677;FLAVIO HENRIQUE ARCOVERDE DE SOUZA ME;sim
25578;AUGUSTO JOSE BATISTA DA SILVA JUNIOR MEI;sim
25576;MANOEL MORAIS DOS SANTOS MEI;sim
25581;M & A CONSTRUCOES LTDA ME;sim
24412;GMF EMPREENDIMENTOS IMOBILIARIOS LTDA ME;sim
25598;DMA CONSTRUCAO CIVIL LTDA ME;sim
25590;F H DE ABREU EIRELI ME;sim
25567;HND HABITACOES LTDA;sim
25600;J S EMPREITEIROS DE MAO DE OBRA LTDA;sim
25550;CELIO CARLOS FERRARI ME;sim
25537;EMPREITEIRA LEITE LTDA ME;sim
25544;ADAO RICARDO DA SILVA MEI;sim
24691;EXTRA EMPREENDIMENTOS EM CONSTRUCAO LTDA ME;sim
25557;LUIZ GONZAGA OLIVEIRA MEI;sim
24684;EZENTIS SERVICOS ENGENHARIA E INSTALACAO DE COMUNICACOES SA;nao
25560;H ALVES DA SILVA PISOS ME;sim
25594;VALDEMIRO DOS SANTOS MEI;sim
25672;WESLEI KUHNEN ME;sim
24735;G P SANTOS ENGENHARIA E CONSTRUCAO LTDA ME;sim
25524;DRAULO EMIR BRESSANI RIBEIRA MEI;sim
25670;MILTON ARAUJO DA SILVA MEI;sim
25691;ALOIZIO AUGUSTO DE MOURA ME;sim
13097;ADRIELE SILVA CONCEICAO MEI;sim
25665;SIMONE SIQUEIRA FRANCA MEI;sim
25615;JULIO CESAR GONCALVES DA SILVA MEI;sim
25604;PAULO HENRIQUE DA SILVA MEI;sim
25663;SEBASTIAO VALDENE AZEVEDO DOS SANTOS MEI;sim
24466;S SOUZA CONSTRUCOES LTDA ME;sim
24439;ALEXANDRE RAMOS DE ABADIO ME;sim
24363;FRANCYS EMPREENDIMENTOS LTDA ME;sim
24502;FREITAS SERVICOS DOMICILIARES E CONSTRUCOES LTDA ME;sim
24368;CCL CONSTRUCOES E COMERCIO LTDA ME;sim
25406;EMPREITEIRA ARRUDA LTDA ME;sim
24395;A M M BARCELOS CONSTRUTORA AQUILA ME;sim
24389;FRAGA CONSTRUCOES E ENGENHARIA LTDA;sim
24397;CRISTINA SANDRI XAVIER;sim
24375;MINDWORKS TECNOLOGIA EIRELI EPP;sim
24365;CONSTRUTORA SKALTSAS LTDA ME;sim
24632;DF AMARAL EPP LTDA;sim
24355;COENGE ENGENHARIA E CONSTRUCOES EPP LTDA;sim
25098;MECANORTE CONSTRUCOES E EMPREENDIMENTOS LTDA;nao
