PK_InfoEmpresas;nm_razao_social;fl_matriz
14518;CESAR LLIUYA PRODUCOES E EVENTOS EIRELI ME;sim
14525;LUCIANE RODRIGUES MARTINS MEI;sim
14523;GLORIA MARIA DE CAMPOS MEI;sim
14529;JOSE ROQUE FERNANDES SANTOS ME;sim
14534;S S A DECORACOES DE ITU LTDA ME;sim
14336;ELLEN CRISTINA CAFALCANTE ME;sim
14341;SUPERMERCADO NOVO MUNDO LTDA ME;sim
14351;INOCENCIA NUNES FERREIRA MARTINS ME;sim
14357;RAFAEL M ANTUNES & CIA LTDA ME;sim
14349;CICLO SASSA & SASSA MOTO PECAS LTDA ME;sim
14338;ROSA DE LIMA GOMES MEI;sim
14345;ARMARINHO E PAPELARIA J E LTDA ME;sim
14354;AGNALDO APARECIDO CINTRA ME;sim
14377;O M TEIXEIRA ME;sim
14366;ANTONIA ALEKSANDRA DE MESQUITA BORGES ME;sim
14369;MANOEL FRANCISCO DE MORAIS ME;sim
14379;M B MARQUES ME;sim
14321;S M COMERCIO DE COSMETICOS LTDA ME;sim
14326;NICOLAU CAVALCANTE DANTAS ME;sim
7094;INACIO RAMOS ME;sim
14316;ALEXANDRA DE OLIVEIRA CARVALHO ME;sim
12012;CELIO CARLOS CAZARINI ME;sim
14323;ANTONIO ALVES DE OLIVEIRA O PEDREIRO ME;sim
14333;JEOVA OLIVEIRA DE MELLO EPP;sim
12040;LEONILDA DE PAULA CARLOS ME;sim
12048;RAIMUNDA MONICA RIBAMAR MARTINS MEI;sim
11876;FRANCISCO GOMES DE ARAUJO BEBIDAS ME;sim
14579;JUNIOR ADRIANO DE OLIVEIRA ME;sim
14576;DJAN S TECNOLOGIA EM INFORMACAO LTDA ME;sim
11960;EDNA SOARES DE SOUZA ME;sim
11966;LINDINALVA MARTINS COSTA MEI;sim
11972;ELIANA ALVES PEREIRA MEI;sim
11989;SUELI FRANCO VIDEOLOCADORA ME;sim
11986;CARDOSO E MACHADO BIJUTERIAS LTDA ME;sim
14584;GILDAIR BANDEIRA SARAIVA MENDES ME;sim
7114;MARILDA DE LOURDES VAZ MEI;sim
14587;SOL DI VERAO INDUSTRIA E COMERCIO DE CONFECCOES LTDA ME;nao
11974;SOLANGE BALBINO DA CRUZ MEI;sim
14589;ANTONIO ROBERTO DOMINGOS CONSTRUCAO EPP;sim
12555;SECRETARIA MUNICIPAL DE SAUDE DE JEQUIE;sim
11977;M R DOS S MARTINS ME;sim
11838;LERICIANA FERREIRA SANTANA MEI;sim
11776;BIFURCACAO COMERCIO DE IMPORTACAO E EXPORTACAO LTDA;nao
12600;MARIA IVONETE SARAIVA DE MOURA MEI;sim
12590;ANDERSON JOSE ROBADEL SANGY MEI;sim
12580;E ANGELO MERCEARIA ME;sim
12570;SEBASTIAO MOREIRA DA CUNHA MEI;sim
12564;DIMED SA DISTRIBUIDORA DE MEDICAMENTOS;nao
12562;THAMYRIS FREITAS DE AQUINO EPP;sim
12568;LIMEIRA & MONTE INDUSTRIA E COMERCIO LTDA ME;nao
12572;CONSTRUIR INCORPORACAO EMPREENDIMENTO IMOBILIARIOS LTDA ME;sim
12585;ASSINE TV SERVICOS DE ASSINATURA LTDA;sim
12582;FORMOSA SUPERMERCADOS E MAGAZINE LTDA;nao
12577;D DOIS INFORMATICA COMERCIO E SERVICOS LTDA ME;sim
12613;ANGELA DE OLIVEIRA WAKUGAWA MEI;sim
12617;REPOI REPRESENTACAO COMERCIAL LTDA ME;sim
12629;DIRCEU OTONI ME;sim
12626;VIAOPEN MEDIA NETWORK TECNOLOGIA LTDA ME;sim
12619;ROSINEYDE SOUZA PEREIRA ME;sim
12622;JOSE AMERICO PEREIRA DA SILVA ME;sim
11770;CDP COMERCIO DE MAQUINAS AGRICOLAS LTDA ME;sim
11780;CLAUDIA ROZANE TATSCH KLAUS ME;sim
11798;GUNARA COMERCIO VAREJISTA DE CAMA MESA BANHO E LAN HOUSE LTDA ME;sim
11795;MARIA DE FATIMA DA SILVA PRESENTES ME;sim
11789;GIGATRON FRANCHISING EIRELI ME;sim
11734;ORTELINA CANDIDO DE OLIVEIRA ME;sim
11739;GRAFICA ITUANA LTDA ME;sim
11763;AZUL CHINES MODAS LTDA;sim
11759;W L PACHECO ME;sim
11751;APARECIDO DOS REIS IEGER DE OLIVEIRA ME;sim
11753;TRAMAPE COM REPRES MAQUINAS PECAS PARA MINERACAO LTDA ME;sim
11791;JOANA PEREIRA DOS SANTOS ME;sim
11871;SOUZA FILHO LOJA DE VARIEDADES LTDA ME;sim
11855;BARA COMERCIO DE PRODUTOS ALIMENTICIOS LTDA ME;nao
11853;ARGEO GRIGORIO ME;sim
11840;E L V COMERCIAL FREITAS EIRELI ME;sim
11814;GIACOMO TEXTIL LTDA ME;sim
11806;EZESA BRASIL PARTICIPACOES LTDA;nao
12067;KATIA MARIA OLIVEIRA VAROTTO ME;sim
14574;POWER SISTEMAS DE INFORMATICA COMERCIO E SERVICOS LTDA ME;sim
14581;JKM COMERCIO E REPRESENTACOES LTDA ME;sim
12107;NELMA COUTINHO RODRIGUES MEI;sim
14572;DROGARIA FARMALU LTDA ME;sim
12074;MARILDA NUNES DE CAMARGO ZAMBONI EPP;sim
12079;V L G ABREU LOPES ME;sim
12095;JOSEILSON INACIO DA CRUZ ME;sim
12103;RITA FELIX DE SOUSA MEI;sim
12780;ITACOR COMERCIO DE TINTAS LTDA;nao
12092;ROSITANIA ALVES DUARTE MEI;sim
12086;ESMAQ LTDA ME;sim
12083;FRANCISCO DE ASSIS DE SOUZA MEI;sim
12786;DEJACKSON ALVARES DE FARIAS ME;sim
7118;REGRA COMERCIO E SERVICO DE ESTETICA LTDA ME;sim
14602;PAULO J R SANTOS ME;sim
12088;ORIDES CICERO DO NASCIMENTO COMERCIO DE MATERIAIS ME;sim
14596;NATAN LUCIANO MARTINS ME;sim
14599;SELMAR LOIVO REICHERT EPP;sim
12778;E I MEDICI DECORACOES ME;sim
14611;ACOUGUE SAO CARLOS LTDA ME;sim
12773;LUCIA MARIA TAVARES ME;sim
12771;ESLAN MAGALHAES ALCANTARA ME;sim
14619;ANTONIO C S DE SOUSA LOCADORA;sim
12775;J & J DE JESUS LTDA ME;sim
12784;SEVERINO DO RAMO FREITAS ME;sim
7123;CESTAO DO POVO DE CASA NOVA EPP LTDA;sim
14621;ODINEIA SUSANA RADAELLI ME;sim
12789;CORINA DE FREITAS CUNHA ME;sim
12803;JORGE MARTINS DA CUNHA MEI;sim
12811;SUELY ROSA DO VALE MEI;sim
12813;COMERCIAL DE ALIMENTOS WERLANG LTDA ME;sim
12801;GLAUCIA FAGUNDES DE MELO MEI;sim
12795;ANDREIA PRATES SPLENDOR ME;sim
12791;SERGIO WILLIAM ROCHA PEREIRA E CIA LTDA ME;sim
12797;HILDEBRANDO ALVES DA SILVA FILHO ME;sim
12809;INOCENTE FERRARI COMERCIO E MANUTENCAO INDUSTRIAL LTDA ME;sim
12761;NECTAR NUTRI ALIMENTOS LTDA;nao
14139;CLAIR TOLEDO DA SILVA MEI;sim
14133;MOLDAG COMERCIAL IMPORTADORA E EXPORTADORA LTDA;sim
12732;MARIA APARECIDA CARDOSO ACCACIO;sim
14124;MELOMANIA MOVEIS EPP LTDA;sim
12820;IVONETE BARBOSA DA SILVA MEI;sim
14126;BRIDAL HOME & FASHION EIRELI ME;sim
14141;CLECIRA SILVIA DE OLIVEIRA MEI;sim
14136;OSCAR CRISTINO & CIA LTDA ME;sim
14146;MADEIREIRA TERTO LTDA ME;sim
12730;MARIA APARECIDA SATURNINO MEI;sim
12725;BLAISE JOGLES DE ALBUQUERQUE PIMENTA MEI;sim
12722;A M I DONAIRE CONFECCOES ME;sim
14157;FLORICULTURA MEDEIROS EPP LTDA;sim
14160;M A R COMERCIO E CONFECCOES DE VESTUARIOS LTDA ME;sim
12727;MARCELO MOREIRA SILVA ME;sim
12769;ROSANGELA MARTINS DE OLIVEIRA ME;sim
12743;SCHROTH E CIA LTDA ME;sim
12759;IVANILDO LANZA REPARACAO DE MOVEIS ME;sim
12763;OLINDA MEIRA DE ARAUJO ME;sim
14154;EMPORIO E QUITANDA DEUTERIO LTDA ME;sim
14152;ROSINEIDE MARIA DE CARVALHO SOUSA MEI;sim
13684;ELIANE RIBEIRO DOS SANTOS NASCIMENTO ME;nao
12766;SAH LINGERIE COMERCIO DE ROUPAS E ACESSORIOS LTDA ME;sim
12757;RONALDO CORREA MEIRELES ME;sim
13680;MARISA BELACHE DAROS BAR;sim
13686;DIAIR ALVES IGNACIO ME;sim
12753;JOSE RICARDO RIBEIRO DE CASTRO LANCHONETE ME;sim
12745;NADIR DA ROCHA MACHADO MEI;sim
12755;RADIAL COMERCIO DE MATERIAIS SERIGRAFICOS LTDA ME;sim
12735;JANIEIRE PAIXAO DE VASCONCELOS ME;sim
12827;ELIANE SIQUEIRA DE MIRANDA ME;sim
12719;TEREZA C DA SILVA OLIVEIRA EPP;sim
12889;J S BUSTAMANTE ME;sim
12894;MARIA DE LOURDES VELOSO ME;sim
12897;MARIA DALVA DOURADO DO NASCIMENTO;sim
12886;CLAUDINEA DE FREITAS SANTOS ME;sim
12879;PIPITA CONFECCOES DE EUGENOPOLIS LTDA ME;sim
12875;OTAVIO ANSELMO DE G FERREIRA ME;sim
7121;JOAO MARIO MATIAS MEI;sim
12883;VEST ROUP COMERCIO DE ROUPAS LTDA ME;sim
12891;RIO VERDE CACA E PESCA LTDA ME;sim
14605;F K VARIEDADES LTDA;sim
12899;NATHALIA LEAL KURKOWSKI ME;sim
12914;J M P MOREIRA;sim
12928;MORGANA GARCIA DEON MEI;sim
13669;GERALDO EUSTAQUIO FARIA REZENDE ME;sim
13672;MIGUEL SALLUM & FILHOS LTDA;nao
13675;FRANCISCO VALTER DA SILVA ME;sim
13677;TARCIANE MARIA SILVA LOPES SANTOS MEI;sim
14613;AUTO POSTO CAZZONATTO LTDA;sim
14615;ATLANTA LTDA ME;sim
12931;KTX CALCADOS LTDA;nao
14608;MARGARIDA CLAUDETE RAFAGNIN MEI;sim
12912;COMERCIO VAREJISTA DE PRODUTOS AGRICOLAS ALEXANDRE LTDA ME;sim
14510;COMERCIAL DELION LTDA ME;sim
14486;PROJETO BASICO MATERIAIS PARA CONSTRUCOES LTDA ME;sim
14505;SOARES DA SILVA & CIA LTDA ME;sim
14508;MOISES HENRIQUE MARTINS MEI;sim
14498;REDE GEFS POSTOS DE SERVICOS LTDA;nao
14491;FARMACIA & DRUGSTORE DUMONE LTDA ME;nao
14432;MUNDO DAS PEDRAS CARAGUA DECORACOES E AR CONDICIONADO LTDA ME;sim
14467;VILSON PAZ DO NASCIMENTO ME;sim
14440;LUIZ CARLOS CASAGRANDE ME;nao
14436;S GOMES DE OLIVERA COMERCIO ME;sim
14430;PADARIA E CONFEITARIA PANZE LTDA ME;sim
14443;DANIELE BENTES DO NASCIMENTO MEI;sim
14455;JOSIAS ALEIXO DA SILVA MEI;sim
14453;ZOE ESPACO DE ESTETICA LTDA ME;sim
14447;M ALVES DOS SANTOS EVENTOS ME;sim
14427;FRANCISCA PINTO DE ANDRADE ME;sim
14419;COMERCIAL DE RADIADORES E BATERIAS CAPIVARI LTDA ME;sim
14412;M DO S B DE MIRANDA ME;sim
14408;SUN FASHION COMERCIO DE ROUPAS LTDA ME;sim
12906;J A OLIVEIRA COMPUTADORES ME;sim
12902;A C F PAULA EMPREITEIRA LTDA ME;sim
12910;BRANCO BASICO LTDA ME;sim
12924;A MOTA DA SILVA LEAL ME;sim
12862;MARILIPE COMERCIO DE CONFECCOES LTDA ME;nao
14410;FRANCINA LOPES DE OLIVEIRA ME;sim
12835;ESTEVAM ROCHA SAVAREZZI MEI;sim
12842;LRA CONFECCOES INDUSTRIA E COMERCIO LTDA ME;sim
14414;ARMAZEM DO SABOR COMERCIAL LTDA ME;sim
14424;ROSANGELA APARECIDA SERAFINI ME;sim
14422;MULTI EQUIPAMENTOS PARA ESCRITORIO LTDA ME;sim
14417;N N MODAS CARAGUATATUBA LTDA ME;sim
14451;LINDACI PEREIRA DA SILVA SERVICOS ELETRICOS ME;sim
14501;ESPACUS COMERCIO E REPRESENTACOES LTDA M E ME;sim
14495;ALEXANDRE CACIANO DA ROSA ME;sim
14493;LUIZ RICARDO GHELERE MOVEIS ME;sim
14489;ALEXANDRO SANTOS GOMES MEI;sim
14328;BK COMERCIO DE PECAS PARA MAQUINAS LTDA ME;sim
12832;ROCHA & LIMOEIRO LTDA ME;nao
12824;GIOVANI DE MOURA CESAR NUNES MEI;sim
12822;J SOUZA COELHO VESTUARIO E COMPLEMENTOS ME;sim
12872;ELIENE SAMPAIO RIOS DA SILVA ME;nao
12839;FRIGOMORRES LTDA ME;sim
12849;LURDES DA SILVA DURANTE MEI;sim
12860;J S VERAS MERCEARIA ME;sim
12866;COSMO DOURADO ME;sim
14122;AKIO ABREU DE LIMA ME;sim
12869;ACTUALLIT INDUSTRIA E COMERCIO DE MOVEIS LTDA ME;sim
14143;TEX BARREDS MODA LTDA;nao
12858;L W NASCIMENTO ME;sim
12854;AUTO POSTO SILVA LTDA ME;sim
14117;SONIA MARIA PINOTTI ME;sim
14100;DOIS IRMAOS RENOVANDO PINTURA PREDIAL EPP LTDA;sim
12856;ADRIANO DOS SANTOS ARAUJO ME;sim
12740;OSMAN FERREIRA DE SANTANA ME;sim
14390;DETROIT SOM E LUZ LTDA ME;sim
14398;FARMACIA FLORENCE EPP LTDA;sim
14383;R C PAIVA ME;sim
14405;JOSE BENEDITO DE CAMARGO SOBRINHO ME;sim
14479;VICTORIA BASILIA ARCANI MACHACA MEI;sim
14484;DISTRIBUIDORA PROGRESSO LTDA ME;nao
14386;CLECIA DE SOUZA VENCESLAU DOS SANTOS ME;sim
14464;MARCIA BACHIEGA QUEVEDO DE SOUZA MEI;sim
14462;EDE CARLOS ALVES PEREIRA ME;sim
12716;K DE JESUS F PEREIRA ME;sim
12685;PAULO ROBERTO ROSA MEI;sim
14330;ANDREIA SIMONE GOMES CAMPOS ME;sim
12701;IDEAL ADMINISTRADORA DE CONDOMINIOS LTDA ME;sim
14364;M F DE ARAUJO MERCADINHO ME;sim
14373;LUCILENE M PEREIRA ME;sim
7128;HIGH INFORMATICA IMPORTACAO E COMERCIO LTDA ME;sim
12683;MIGUEL DE FATIMA ARRUDA MERCEARIA ME;sim
14381;DIMELL COM E MANUT DE MAQ DE ESCREVER E LAVAR LTDA ME;sim
14361;V C DOS SANTOS ME;sim
36603;TORNOFER EPP LTDA;sim
14627;ADELCIO GRUBANO MEI;sim
14643;TECHNOLOGY CHEMICAL PRODUTOS QUIMICOS LTDA ME;sim
14735;ANTONIO ARCANJO LOPES ME;sim
14645;JJ PETROLEO LTDA ME;sim
14637;BELLA IMAGEM CABELEIREIROS LTDA ME;sim
14655;TATIANE LUCIA GONCALVES MEI;sim
14662;ODAILTON PIO MARTINS MEI;sim
14664;BRUNO MENEZES MELLO MEI;sim
14641;E H COSTA FRIOS ME;sim
36638;SERRATORNO SERRALHARIA & TORNEARIA LTDA ME;sim
14737;ACTUM INDUSTRIA E COMERCIO LTDA;nao
14713;DEPOSITO DE AREIA NOVA PRATA EPP LTDA;sim
14657;MAHMUD MARTINS KHALAF EIRELI ME;sim
14639;LUZIA CRISTINA TOMAS DE AQUINO MEI;sim
14653;CONFECCOES MAC BRENDLER LTDA ME;sim
14647;FRANCISCO ALMEIDA BARBOSA MEI;sim
14629;PARAISO SG COMERCIO DE MOVEIS E DECORACOES EIRELI ME;sim
14635;JOAO JOSE PEDRO DOS SANTOS ARMAZEM ME;sim
36338;JEAN EVERTON MARTINS MEI;sim
14799;R E DA SILVA DIOGO;sim
36358;V&S TRANSPORTES EPP LTDA;sim
36367;C G EXPRESS LTDA ME;sim
14797;SILVA COMERCIO DE VIDROS LTDA ME;sim
36349;PEREIRA MOTOS PRESTADORA DE SERVICOS LTDA ME;sim
36320;TRANSFLAP TRANSPORTES LTDA ME;sim
6482;ELIZIANE SILVA SANTANA MEI;sim
36374;LEANDRO PEREIRA DE MIRANDA MEI;sim
7151;VALDETE GUETNER ME;sim
7154;ANTONIO MADEIRA ME;sim
14632;MARIA CONCEICAO DE MAURO CONFECCOES ME;sim
36313;ALEX SANDRO TEIXEIRA DOS REIS MEI;sim
36341;GILDETE DOS SANTOS FAGUNDES MEI;sim
14625;ANDREA CLEONICE DA SILVA ME;sim
36416;BRAZ JOSE DE ARAUJO JUNIOR MEI;sim
36414;MICHELE PEDROSO DOS SANTOS MEI;sim
14694;C & B COMERCIO E SERVICOS LTDA ME;sim
14690;MARLENE APARECIDA DO NASCIMENTO ME;sim
36411;SANDRO DOLORES FERREIRA RIBEIRO MEI;sim
14683;SANDRA MARIA PEREIRA SILVA RACOES & CIA ME;sim
14685;REFRIMONTE REFRIGERACAO MONTESE LTDA ME;sim
14688;MARIA DE LOURDES LIMA DA SILVA;sim
36418;PAULO HENRIQUE SIQUEIRA ME;sim
14696;NADIA DE OLIVEIRA GUIMARAES BAR E MERCEARIA ME;sim
14707;COLEMAR PEREIRA DE OLIVEIRA ME;sim
36420;GILBERTO FRANCISCO MEI;sim
36407;EZEQUIEL RIBEIRO GUILHERME MEI;sim
36398;FABIO MARTINS DE FREITAS MEI;sim
36385;MARCELO BEZERRA CAETANO MEI;sim
36376;RONALDO OLIVEIRA DE CARVALHO MEI;sim
36400;GOVINDA COURIER EIRELI ME;sim
14709;VANDER LUCIO FERREIRA MOURAO MEI;sim
36405;LEANDRO ANTUNES DOS SANTOS MEI;sim
36508;TECHNOUSI ALMAR INDUSTRIA E COMERCIO DE AUTO PECAS E USINAGEM LTDA;sim
14705;ANA GONCALVES DA SILVA ME;sim
37228;RONNIE BORGES DE OLIVEIRA MEI;sim
36787;D R NAVARRO CONSULTORIA EMPRESARIAL LTDA ME;sim
36811;SAYONARA MOTEL LTDA ME;sim
14816;C R M MOREIRA ME;sim
36814;OLIVEIRA VOLPATO & CIA LTDA ME;sim
36783;ROCHA E REZENDE ASSESSORIA LTDA;sim
14806;J M E AGRIPINO ME;sim
14801;SONIA BARROS DA SILVA ME;sim
36774;ABENCORP ASSESSORIA E CONSULTORIA LTDA ME;sim
14795;DOMINGOS RODRIGUES PALITO TOMAZ MEI;sim
14698;LENILCIO DO VALE SANTANA MEI;sim
14700;A M DE RESENDE JUNIOR ME;sim
36771;CCS CONSULTORIA LTDA ME;sim
36678;VANILDA DE SOUZA BORGES MACHADO SERRALHERIA ME;sim
14681;MARIA DAS GRACAS SILVA LEITE ME;sim
36666;DAVI DOS SANTOS DE ALMEIDA ME;sim
36750;ADALBERTO BANZATI VIANA;sim
14922;JANETE DE QUEIROZ PERRET MEI;sim
14919;EDONIR ANTONIO ROSA ME;sim
14914;L LOPES COMERCIO DE EMBALAGENS LTDA ME;sim
14916;INSTITUTO COMERCIAL DE PRODUTOS OTICOS LTDA ME;sim
14924;MARILENE DOS SANTOS CORTES ME;sim
14933;ILSA RIBAS PAES ME;sim
14931;ADRIANA RODRIGUES DIAS DA CUNHA;sim
14926;MERCEARIA NOVA LEOPOLDINA LTDA ME;sim
14910;MOVEIS E DECORACOES INDAIA EPP LTDA;nao
14897;APARECIDA NASCIMENTO SANTOS ME;sim
14885;FERREIRA COMERCIO DE MOVEIS LTDA ME;nao
14871;TECNOESTE COMERCIO DE EQUIPAMENTOS AVICOLAS LTDA ME;sim
14875;ADRIANA OLIVEIRA LOPES ARAUJO PRESTAO DE SERVICOS ME;sim
14888;WASHINGTON LUIS DE PAULA E SOUZA ME;sim
14907;MARIANO NOVINSKI ME;sim
14899;TEMILSON GONCALVES SCHWARTZ ME;sim
14891;FARMAGE FARMACIA DE MANIPULACAO EPP LTDA;sim
14929;MARIA DE JESUS RIBEIRO DE SANTO AMARO;sim
14994;JOSE ALBERTO MENDES MEI;sim
14985;LAERCIO CIACARELLI PECAS ME;nao
14980;MCXI COMERCIAL E IMPORTACAO DE ALIMENTOS LTDA ME;sim
14970;METAP METAIS DO TAPAJOS COMERCIO LTDA ME;sim
14974;TORNADO INFORMATICA E CONSTRUCOES LTDA ME;sim
14988;JOSE MOYSES ARAUJO DOS SANTOS RUFFEIL MEI;sim
14998;COMERCIAL PRATA DE ALIMENTOS LTDA ME;sim
14996;GERALDO BIONE DA SILVA ME;sim
14938;MAIARA AYRES GONTIJO MEI;sim
14967;MARCELO REIS DE MELLO MEI;sim
14961;ELIZA LUMIKO KITAHARA ME;sim
14948;OVELHA NEGRA BAR RESTAURANTE ADMINISTRACOES E PARTICIPACOES LTDA ME;sim
14945;MARIA JOSE VENAZ MEI;sim
14940;W B FERNANDEZ INFORMATICA ME;sim
7171;SERGIO MIYUKI SATO ME;sim
14955;ODETE DE FATIMA CORREA ROSA ME;nao
14818;JOSEFA PEREIRA CESAR FLORICULTURA ME;sim
14823;SOLANGE VALLADAO DE MELLO MEI;sim
7183;CASA DE FRIOS JK LTDA ME;sim
14831;DROGARIA NEVES & COSTA LTDA ME;sim
14843;FINA FESTA BY ELIZ EVENTOS LTDA ME;sim
14837;EDVANDO ADELINO BASTOS MEI;sim
14839;ROSA MARIA DE MEDEIROS LESSA ROLEMBERG MEI;sim
14803;OSWALDO GABRIEL MORUNGABA ME;sim
14750;QUALITY COMERCIO DE ARTIGOS DE PAPELARIA E INFORMATICA LTDA ME;sim
14741;ANGELITA PINTO ME;sim
14746;CARLOS ROBERTO GRANGEIRO RODRIGUES ME;sim
14764;NAJUA TALITA PONTES DE HOLANDA MODAS ME;sim
14757;NETSCAN DIGITAL LTDA;nao
14744;JOSIAS MARCO MARTINS SIGUEIRA ME;sim
14739;GIVERNY COMERCIO DE CONFECCOES LTDA ME;sim
14753;JORGE RICARDO BABY MEI;sim
12631;PALMA PRESENTES E CONFECCOES LTDA ME;sim
36676;RODRIGO DUARTE DE MATOS MEI;sim
14748;ODILEIA APARECIDA NUNES ME;sim
36692;DISTRIBUIDORA DE AUTO PECAS DOIS IRMAOS LTDA;nao
34768;EDMUNDO DE SEPEDRO GOMES MEI;sim
7189;MUNDO ELETRICO LTDA ME;sim
14965;VALDECI FREITAS DE OLIVEIRA SILVA ME;sim
34765;PORTAS PRONTAS BARRETO LTDA ME;sim
14963;A E DO N PEREIRA & CIA LTDA ME;sim
14957;DANIA ANA MATHEI;sim
7192;IRENE CUSTODIO ME;sim
15004;RCM COMERCIO DE CARTUCHOS E TONER S LTDA ME;sim
14992;M SCHERR & CIA LTDA ME;sim
36728;H 2 CONSULTORIA LTDA SS;sim
7195;IVONE TEREZINHA KEMPKA ME;sim
7198;ALTO MAR COMERCIAL DE PESCADOS LTDA ME;sim
7202;SOLO COTONE ARTIGOS DO VESTUARIO LTDA ME;sim
7205;SINDICATO DO SAARA ROUPAS LTDA;sim
7208;JOSE MARIA RAMOS ME;sim
34759;ANTONIO SACHETTI ME;sim
14766;G F DE LIMA ME;sim
34762;RENOVATUS INDUSTRIA & COMERCIO DE MADEIRAS LTDA ME;nao
34797;JEANNE SOUSA ME;sim
37253;R C A GRAFICA EDITORA LTDA ME;sim
15165;ELITON ALVES ME;sim
15185;B P GONSIORKIEWICZ ME;sim
15193;LAGOA LOTERIAS LTDA ME;sim
15103;RENATA PRIETO DE OLIVEIRA DEAK ME;sim
15160;DIPIU COMERCIO DE MOVEIS PARA ESCRITORIO E RESIDENCIA EPP LTDA;sim
15171;ELETRO FRIO ESTRELA DA LIBERDADE LTDA ME;sim
15152;ELMA VIVIANE PAIVA AMORIM MEI;sim
15134;JCE CONSULTORIA E PARTICIPACOES LTDA;nao
15137;ALZENIR SANTANA COMERCIO LTDA ME;sim
15141;LUCIANA BONFIM AMORIM PIEROTE ME;nao
15143;CASSILANDRO RIBEIRO FREIRE ME;sim
15253;DEBORA PINHEIRO DA SILVA MEI;sim
15147;JOSE ROBERTO TELLES DOS SANTOS MEI;sim
15149;C A S GONCALVES ME;sim
15155;LUIS CARLOS DE ARAUJO MEI;sim
15169;J FAILLI RIO PRETO LTDA ME;sim
15113;MARGARETE PEREIRA ARCENIO MEI;sim
15093;SUPERTAP SA FERRAMENTAS DE PRECISAO;nao
37054;RVM PRODUCOES E EVENTOS LTDA ME;sim
37075;ACADEMIA RECIFENSE DE LETRAS;sim
15096;OZANILDA ALVES DE SOUZA ME;sim
37096;SIRIUS REPRESENTACOES ARTISTICAS LTDA ME SC;sim
37028;AMANDA BRAZ DE LIMA MEI;sim
15109;JAILSON BEZERRA PEREIRA ME;sim
37233;F VAITMAN BUCHOLTZ ME;sim
15118;PET CAO PRODUTOS VETERINARIOS LTDA ME;sim
15129;SEBASTIAO MIGUEL DE CAMPOS ME;sim
15115;MARIZA CRISTIANE ALTHAUS MEI;sim
15106;DROGARIA SANTA FE & VARIEDADES LTDA ME;sim
15123;N P GONCALVES ALIMENTOS LTDA ME;sim
15101;MARGARETH BEZERRA CORDEIRO DA SILVA ME;sim
15198;ARTECLASSE ESTOFADOS EIRELI;sim
15195;CASA DE CARNES NORDESTE LTDA ME;sim
15204;TOSHIO TATSUMI MARACAI ME;sim
15207;O WEHRMANN E CIA LTDA M E ME;sim
15242;ROMERIO RODRIGUES LEITE ME;sim
37236;GRAFICA SOUZA & LIMA LTDA ME;sim
15334;RITMO REPRESENTACOES LTDA ME;sim
15339;DIEGO DE PINHO FARIAS ME;sim
7230;RIVELI KIDS COMERCIO VAREJISTA LTDA ME;sim
37202;S L COSTELLI POLITI ME;sim
37135;HYPERMARCAS SA;nao
37133;MORGANA BARBARA CAVALCANTE SAMPAIO MEI;sim
7233;JOANA CANDIDA DA SILVA ESTRELA D OESTE ME;sim
15349;FARMANIMAL FARMACIA DE MANIPULACAO VETERINARIA LTDA ME;sim
37145;ENVELOPEL INDUSTRIA E COMERCIO LTDA ME;sim
37177;BRAGA & COSTA LTDA ME;sim
36871;AGUIMAR ANTONIO ROCHA ME;sim
36890;MAURI MANOEL DE GUIMARAES ME;sim
15346;GERALDO DUTRA DE ABREU ME;sim
15183;COMERCIAL T PAULISTA EPP LTDA;sim
15341;LUCIANE COSMO BATISTA MEI;sim
15344;JOAO IRIS TELES NUNES ME;sim
36894;M E XIMENES DA SILVA ME;sim
15180;PALOMA VEBER SOETHE MEI;sim
15188;RAFAELA DE O G ELIAS CALHAS EIRELI ME;sim
36897;GRECY GONCALVES DE SOUZA ME;sim
15191;I DE L MOREIRA DE MORAES CALCADOS ME;sim
15202;SILVANI PRATES DOS SANTOS ME;sim
15210;MARINETE SILVA PEREIRA MEI;sim
15232;H D INFORMATICA LTDA ME;sim
15230;MOVEIS PORTUGUES LTDA ME;sim
15237;IOLANDA CIRINO ME;sim
15240;VALDIVIA ROSA DOS SANTOS LIMA ME;sim
15228;MERCADAO DE CARNES CACHOEIRINHA LTDA ME;sim
15217;S DE SENA FERREIRA ME;sim
15214;RICARDO JOSE DA ROCHA MEI;sim
15212;FERRAGEM CAPPELLARI LTDA ME;sim
15224;O F DE OLIVEIRA ME;sim
36887;MARCIA M F R DA SILVA;sim
15226;JOSIAS ALVES DE CAMPOS MEI;sim
15247;G MARIA DE AMORIM ME;sim
36883;MARIA APARECIDA FLORENCIO DE SOUZA MELO ME;sim
14730;IVO DE LIMA NETO MEI;sim
14725;L A SANTOS EPP LTDA;sim
36899;PRAIAS DO FLAMENGO LOFTS TURISMO LTDA ME;sim
14716;ALDECI SOUZA DA SILVA ME;sim
36965;ASSOCIACAO BENEFICENTE AUE DE CULTURA E ARTES;sim
14719;RAFAEL MALLMANN DOS SANTOS MEI;sim
37020;J A PROMOCOES ARTISTICAS LTDA ME;sim
37026;BANDA EL SHADAY;sim
36941;BIRIBA PRODUCOES ARTISTICAS LTDA ME;sim
36902;TRILHA HOTEL TURISMO LTDA ME;sim
36905;SOLANGE REGINA MARTELOZZO BAPTISTA ME;sim
36949;EDILSON JOSE RODRIGUES ME;sim
36892;ALPHA APART HOTEIS LTDA ME;sim
14723;DICOMA DISTR E COM DE MATERIAIS DE CONSTRUCAO LTDA ME;nao
36971;JODINEI ANTUNES RANGEL MEI;sim
37058;ROSELITO GONZALES LIMA DE MENEZES ME;sim
14733;ROBSOM VITORIO VIECILI ME;sim
14672;MARIA DEDI DA CONCEICAO VESTUARIOS ME;sim
37078;ANA REGINA DE MORAES CUNHA MEI;sim
37114;WADIH HONSI;nao
37083;R V DUROES ME;sim
37126;WOLFRIED ROLOFF ME;sim
36669;H SIQUEIRA;sim
36711;FIDELIZAR ASSESSORIA LTDA ME;sim
36697;METALSKY SERRALHARIA E MARCENARIA LTDA ME;sim
36716;BELLELIS & CIA CONSULTORIA E ASSESSORIA EM GESTAO EMPRESARIAL LTDA ME;sim
36742;FORMAS UTEIS CONSULTORIA LTDA ME;sim
36721;ALEX FERNANDO SANCHEZ LOPES ME;sim
36663;FERRALBOX IND E COM DE ARTEFATOS DE METAL LTDA ME;sim
36672;ANADE DE SANTANA SANTOS ME;sim
36681;SERGIO ROBERTO DA SILVA ROCHA ME;sim
36674;LUIZ WORSPITE NETO & CIA LTDA ME;sim
36724;PRO BRASIL SERVICOS EM RECUPERACAO DE EMPRESAS LTDA SS;sim
36854;KARINE DA CONCEICAO SOUSA DE LORENA ME;sim
36831;TEREZA CRISTINA MAIA SILVA BENICIO ME;sim
36819;ERIVALDO VIEIRA CARDOSO ME;nao
15145;ROSANIA DIAS VIEIRA MEI;sim
15139;ACADEMIA C 4 FITNESS LTDA ME;sim
15098;LM COMERCIO DE MOVEIS EIRELI ME;nao
15162;XEQ MAQ COMERCIO DE MAQUINA PARA ESCRITORIO LTDA ME;nao
36823;ISRAEL HENRIQUE DA SILVA ME;sim
15262;AGILIS MOTOCICLE LTDA;sim
14943;COMERCIO DE PEDRAS FLOR DA SERRA LTDA ME;sim
15260;MOACIR LUIZ DA SILVA VARGAS ME;sim
15251;RECANTO DA MODA CALCADOS E CONFECCOES LTDA;sim
15244;COMERCIO FASHION BIJU LTDA ME;sim
15257;LIVRARIA DA SE INDUSTRIA E COMERCIO LTDA ME;sim
15265;BAR E LANCHONETE PAYSAGE LTDA ME;nao
15234;MARCI VICENTE PSCHEIDT ME;sim
7211;ANTONIO FRANCISCO LIMA LEAL MEI;sim
15177;FARLEY SILVA LEITE ME;sim
36835;MOTEL SKORPIUS DE ITUMBIARA LTDA;sim
36863;LIDER ORGANIZACAO HOTELEIRA LTDA ME;sim
36849;VALLEY HOTEL E TURISMO EPP LTDA;sim
36817;KATIELEN HOTEL LTDA ME;sim
36641;PERFITEC INDUSTRIA MECANICA EPP LTDA;sim
36808;M PEREIRA DOS SANTOS ME;sim
14677;PATRICIA DA SILVA VAZ MEI;sim
14679;ANTONIO MIRANDA ME;sim
7237;M S L GOMES ME;sim
36781;FLDX CONSULTORIA E SERVICOS EPP LTDA;sim
14675;COMERCIAL PURIFICADOR DE AGUAS LTDA ME;nao
37278;THIAGO SANTANA DE OLIVEIRA MEI;sim
15174;ADRIANA RESENDE LOPES ME;sim
7240;JOSE APARECIDO DE OLIVEIRA MEI;sim
15132;EDEGAR PEREIRA MEI;sim
15158;LUCIANA FERNANDES DA CRUZ MEI;sim
37275;OSCAR TEIXEIRA LIMA;sim
37280;AJ MELLO SERVICOS GRAFICOS LTDA ME;sim
37259;PALMETTO SERVICOS GRAFICOS EPP LTDA;sim
7243;MARILEIDE PEREIRA ME;sim
37262;DINO PAIVA EDITORACAO GRAFICA LTDA ME;sim
36438;CWB METAIS E SERVICOS EIRELI ME;sim
33830;CENTRO DE EDUCACAO ESTACAO CRIANCA LTDA ME;sim
33853;M L N ASSESSORIA E CONSULTORIA LTDA;nao
35303;ARNALDO RIBAS GATO ME;sim
35321;AUTO ESTACIONAMENTO EPP LTDA;nao
35305;AUTO SOCORRO KOVACS LTDA ME;sim
33806;CARVALHO CULTURA E COMERCIO LTDA ME;sim
35327;RADIO TAXI CENTRAL EIRELI ME;sim
35323;CENTRO NORTE GUINCHOS LTDA ME;sim
33826;A ALVES CORREA NETO;nao
35315;PRAIA E CAMPO MOVEIS E DECORACAO DE EXTERIORES LTDA ME;nao
35313;CONDOMINIO RIO CERRO;sim
34979;LUIS CARLOS GOULART MONTAGENS ME;sim
35048;JOSE ROBERIO DE OLIVEIRA MEI;sim
33888;ESCOLA DE INFORMATICA NOTAVEL LTDA;sim
35043;SHESTER MASCARELLO;sim
35046;PEDRO PIRES JUNIOR EPP;sim
35052;WALLPEC CONSTRUCOES E EQUIPAMENTOS LTDA ME;nao
33880;CAIXA ESCOLAR QUEIROZ JUNIOR;sim
15356;DIMAS PEREIRA DE SOUZA JUNIOR ME;sim
15354;PLASFORRO PERFIS DE PVC LTDA;nao
7246;ARY RAPOSO ALARMES ME;sim
35398;MR LOCADORA DE VEICULOS LTDA ME;sim
35408;ADOLFO RODRIGUES GONCALVES ME;sim
15351;R F DO COUTO COMERCIAL ME;sim
35411;ALOISIO JOSE COSTA MEI;sim
35395;ARMANDO EBERHART ME;sim
35056;QUALY SERVICOS GERAIS E CONSTRUCOES EPP LTDA;sim
35036;HIDRAULIC SERVICE CENTER EQUIPAMENTOS HIDRAULICOS EPP LTDA;sim
35026;GILVAN ELIAS DOS SANTOS MEI;sim
35116;RODINEI RODRIGUES DE LIMA MEI;sim
34938;CARLOS AUGUSTO PEREIRA DA SILVA MEI;sim
34956;RONALDO MACHADO TRINDADE JUNIOR MEI;sim
34986;HELIAS FERNANDES DE OLIVEIRA JUNIOR MEI;sim
35034;WILSON J SANTOS REFRIGERACAO E INSTALACAO LTDA ME;sim
35031;PARAISO DAS AGUAS REFRIGERACAO LTDA ME;sim
33882;UNIVERSIDADE FEDERAL DO RIO DE JANEIRO;nao
34990;KINETIC INDUSTRIA E COM DE PRODS ELETRO ELETRON LTDA;sim
35086;ELVIRIA MARIA ISIDORO DANTAS MEI;sim
35216;F DOS SANTOS VALET ME;sim
33871;INSTITUTO MANTENEDOR DE EDUC E DESENV PROF ALTIORA;sim
33817;CLODOALDO SANTANA DE SOUZA MEI;sim
35199;EDSON DE ARAUJO DUTRA ME;sim
33732;C B DE CASTRO & FIGUEIREDO LTDA ME;sim
33598;MSU CONSULTORIA E ADMINISTRACAO LTDA ME SC;nao
35186;ARGIREIA COMERCIO E EXTRACAO DE AREIA LTDA ME;sim
35195;EMPRESA DE MINERACAO ANGELO MICUCI LTDA ME;sim
35201;DILSON FERREIRA DOS SANTOS BRITAMENTO DE PEDRAS ME;sim
35268;MATTE VIAGENS TURISMO LTDA ME;sim
35262;HEAVYWEIGHT AIR EXPRESS TRANSPORTES BRASIL LTDA;sim
35212;M E P DOS SANTOS AGENCIADORA ME;sim
33594;RENILTON PAULO DE CALDAS ME;sim
35178;GAUDENCIO & AUERSVALD LTDA ME;sim
35167;EXTRACAO E COMERCIO DE AREIA COSTA LTDA;sim
33730;ASAS DE SOCORRO;nao
33727;COLEGIO ESTADUAL JOSE DANTAS DE SOUZA;sim
33735;CONSTRUINDO O FUTURO;sim
35142;OSORIO ALVES CAMPOS ME;sim
33737;SOC CARIT E LIT SAO FRANCISCO DE ASSIS ZONA NORTE;nao
7253;DJAVAN SANTIAGO SOUSA MEI;sim
35121;JEAN CHRISTIAN FAGUNDES MEI;sim
33721;CLARA MARIA XAVIER PLACIDO MEI;sim
33699;ADENIR ANTONIO VELOSO ME;sim
35285;MIBEANA CARGAS EXPRESS LTDA ME;nao
33693;CENTRO DE FORMACAO DE CONDUTORES SOLUCAO LTDA ME;nao
33707;CAIXA ESCOLAR CENTRO DE EDUCACAO INFANTIL MUNICIPAL PROFESSORA ODILA AZEVEDO MARQUES PAIVA;sim
33712;CENTRO DE FORMACAO DE CONDUTORES IRANI LTDA ME;sim
33688;PDCA CONSULTORIA EM QUALIDADE LTDA ME SC;sim
33741;JARDIM ESCOLA ABC DA ALEGRIA LTDA ME;sim
33771;NANGEO LTDA ME;sim
35393;TEO CAR PARKING ADMINISTRAC DE ESTACIONAMENTOS EPP LTDA;nao
33767;EXATO CONSULTORIA E GESTAO EMPRESARIAL LTDA;sim
33781;G 3 NEGOCIOS SERVICOS PARA ESCRITORIOS LTDA ME;nao
35335;J CARVALHO ENCOMENDAS LTDA ME;nao
35389;CAMAR ASSESSORIA INTERNACIONAL EPP LTDA;sim
35382;CROSARIOL MINE ESTACIONAMENTO LTDA ME;sim
35380;GARAGE VITORIA LTDA ME;nao
35385;C 3 PARKING ESTACIONAMENTOS LTDA;nao
35172;CASSIANO MINERACAO LTDA ME;sim
35387;AUTO SOCORRO FARIA & SILVA LTDA ME;sim
35350;PLINIO CURI COMERCIAL IMPORTADORA E EXPORTADORA EPP LTDA;nao
